parent_post_id,conversation_type,subtree_id,subtree_root_author,subtree_root_depth,subtree_max_depth,subtree_depth_span,comment_id,author,normalized_depth,original_depth,timestamp,score,word_count,character_count,avg_word_length,cleaned_text_sample,depth_cap_applied,max_depth_analyzed
post10con,controversial,deepest_subtree_gut-brain-axis_level4,gut-brain-axis,0,4,4,deepest_subtree_gut-brain-axis_level4_comment_0001,gut-brain-axis,0,0,2023-11-30 16:00:20,68,33,161,3.85,We do but we also need to give women a break from fixing things all the time. Its not our fault we w...,Yes,4
post10con,controversial,deepest_subtree_gut-brain-axis_level4,gut-brain-axis,0,4,4,deepest_subtree_gut-brain-axis_level4_comment_0002,purple_paramecium,1,1,2023-11-30 22:55:03,43,129,683,4.16,"Yes, thank you. Ive decided that my ultimate goal in life is to be a shining example of a woman in S...",Yes,4
post10con,controversial,deepest_subtree_gut-brain-axis_level4,gut-brain-axis,0,4,4,deepest_subtree_gut-brain-axis_level4_comment_0003,gut-brain-axis,2,2,2023-12-01 00:21:31,11,17,91,4.12,Yes!!! This. Let me write code and let some dude do the DI committee and outreach nonsense.,Yes,4
post10con,controversial,deepest_subtree_gut-brain-axis_level4,gut-brain-axis,0,4,4,deepest_subtree_gut-brain-axis_level4_comment_0004,shapelessdreams,3,3,2023-12-01 12:27:23,3,17,108,5.35,Sadly for juniors this will mean more discrimination and difficulty with mentorship. It feels like a...,Yes,4
post10con,controversial,deepest_subtree_gut-brain-axis_level4,gut-brain-axis,0,4,4,deepest_subtree_gut-brain-axis_level4_comment_0005,gut-brain-axis,4,4,2023-12-01 18:45:46,3,50,256,4.04,Thats not really our problem. If it doesnt get done if women dont do the work there is clearly a lac...,Yes,4
post10con,controversial,deepest_subtree_gut-brain-axis_level4,gut-brain-axis,0,4,4,deepest_subtree_gut-brain-axis_level4_comment_0006,beepbooplazer,2,2,2023-12-01 00:24:25,6,39,218,4.41,Yep. I went hard on leadership and outreach when I was an undergraduate. I still give back sometimes...,Yes,4
post10con,controversial,deepest_subtree_gut-brain-axis_level4,gut-brain-axis,0,4,4,deepest_subtree_gut-brain-axis_level4_comment_0007,snotsnack,2,2,2023-12-01 05:11:53,3,28,141,4.07,I forget where I heard it first but Ive been calling this breaking the glass floor when you can be c...,Yes,4
post10con,controversial,deepest_subtree_gut-brain-axis_level4,gut-brain-axis,0,4,4,deepest_subtree_gut-brain-axis_level4_comment_0008,ruebzcube,1,1,2023-11-30 21:11:41,9,13,62,3.85,In theory I agree but in reality how else will things get done,Yes,4
post10con,controversial,deepest_subtree_gut-brain-axis_level4,gut-brain-axis,0,4,4,deepest_subtree_gut-brain-axis_level4_comment_0009,gut-brain-axis,2,2,2023-11-30 21:24:27,6,5,27,4.2,They wont. Not our problem.,Yes,4
post10con,controversial,deepest_subtree_gut-brain-axis_level4,gut-brain-axis,0,4,4,deepest_subtree_gut-brain-axis_level4_comment_0010,Fun_Mathematician_73,3,3,2023-12-01 00:18:25,2,2,16,7.5,Incredibly based,Yes,4
post10con,controversial,deepest_subtree_gut-brain-axis_level4,gut-brain-axis,0,4,4,deepest_subtree_gut-brain-axis_level4_comment_0011,Commander_in_Queef1,2,2,2023-12-02 22:04:02,1,6,39,5.5,With time and being highly compensated.,Yes,4
post10con,controversial,deepest_subtree_gut-brain-axis_level4,gut-brain-axis,0,4,4,deepest_subtree_gut-brain-axis_level4_comment_0012,clover_heron,1,1,2023-12-03 11:17:41,1,26,151,4.77,oh wow you overlooked an obvious problem for years because you lack insight and are insufficiently e...,Yes,4
post10tec,technical,deepest_subtree_Jean-Porte_level4,Jean-Porte,0,4,4,deepest_subtree_Jean-Porte_level4_comment_0001,Jean-Porte,0,0,2023-02-02 08:50:29,24,54,363,5.61,The traditional language modeling loss negative loglikelihood is misaligned with human expectations....,Yes,4
post10tec,technical,deepest_subtree_Jean-Porte_level4,Jean-Porte,0,4,4,deepest_subtree_Jean-Porte_level4_comment_0002,alpha-meta,1,1,2023-02-02 09:33:56,4,52,280,4.29,"But isnt this only if you train it on the loss negative loglikelihood via nextword prediction, i.e.,...",Yes,4
post10tec,technical,deepest_subtree_Jean-Porte_level4,Jean-Porte,0,4,4,deepest_subtree_Jean-Porte_level4_comment_0003,Jean-Porte,2,2,2023-02-02 10:21:51,6,31,136,3.42,Yes but the LM has to take many steps to produce the text We need to train the LM to maximize a fara...,Yes,4
post10tec,technical,deepest_subtree_Jean-Porte_level4,Jean-Porte,0,4,4,deepest_subtree_Jean-Porte_level4_comment_0004,alpha-meta,3,3,2023-02-02 13:04:24,2,48,278,4.71,Could you help me understand what the faraway rewards represent here in this context? The steps are ...,Yes,4
post10tec,technical,deepest_subtree_Jean-Porte_level4,Jean-Porte,0,4,4,deepest_subtree_Jean-Porte_level4_comment_0005,Jean-Porte,4,4,2023-02-02 13:15:27,7,38,217,4.61,"The beginning of the best possible answer might not be the best beginning. Its the final outcome, th...",Yes,4
post12con,controversial,deepest_subtree_KeptinGL6_level4,KeptinGL6,0,4,4,deepest_subtree_KeptinGL6_level4_comment_0001,KeptinGL6,0,0,2024-06-01 08:27:13,50,21,130,5.1,"Science has shown that all humans, regardless of sex or sexual orientation, respond more strongly to...",Yes,4
post12con,controversial,deepest_subtree_KeptinGL6_level4,KeptinGL6,0,4,4,deepest_subtree_KeptinGL6_level4_comment_0002,Mindofmierda90,1,1,2024-06-01 10:31:34,34,21,116,4.43,"Unless directives are being given. In New York, its a male voice that gives orders stand clear of th...",Yes,4
post12con,controversial,deepest_subtree_KeptinGL6_level4,KeptinGL6,0,4,4,deepest_subtree_KeptinGL6_level4_comment_0003,Juntubre22,1,1,2024-06-01 10:00:33,9,5,24,4.0,Except for books on tape,Yes,4
post12con,controversial,deepest_subtree_KeptinGL6_level4,KeptinGL6,0,4,4,deepest_subtree_KeptinGL6_level4_comment_0004,jemuzu_bondo,1,1,2024-06-01 12:22:36,5,34,196,4.71,I guess it depends what is meant by respond more strongly. Studies have shown that people elect men ...,Yes,4
post12con,controversial,deepest_subtree_KeptinGL6_level4,KeptinGL6,0,4,4,deepest_subtree_KeptinGL6_level4_comment_0005,skippy_1037,1,1,2024-06-01 18:58:24,2,28,175,5.21,This raises the question of accent as well where it is predominantly the American accent with someth...,Yes,4
post12con,controversial,deepest_subtree_KeptinGL6_level4,KeptinGL6,0,4,4,deepest_subtree_KeptinGL6_level4_comment_0006,AylwinJoshua,1,1,2024-06-01 22:44:59,2,17,96,4.71,This is true thats why emergency warnings for pilots even in military jets are voiced by females,Yes,4
post12con,controversial,deepest_subtree_KeptinGL6_level4,KeptinGL6,0,4,4,deepest_subtree_KeptinGL6_level4_comment_0007,Better_Ad2013,1,1,2024-06-01 08:56:32,-22,13,79,4.85,Probably because in female for 9 months? The eternal feminine leads us aloft...,Yes,4
post12con,controversial,deepest_subtree_KeptinGL6_level4,KeptinGL6,0,4,4,deepest_subtree_KeptinGL6_level4_comment_0008,ClaraGilmore23,2,2,2024-06-01 10:35:24,11,20,123,5.05,umm.. anyway look at this dog as a reward for not scraping ur eyes out after reading that 3 !gifgiph...,Yes,4
post12con,controversial,deepest_subtree_KeptinGL6_level4,KeptinGL6,0,4,4,deepest_subtree_KeptinGL6_level4_comment_0009,Katharinemaddison,3,3,2024-06-01 14:32:11,2,5,22,3.2,Thank you! A good dog.,Yes,4
post12con,controversial,deepest_subtree_KeptinGL6_level4,KeptinGL6,0,4,4,deepest_subtree_KeptinGL6_level4_comment_0010,Deleted,3,3,2024-06-01 13:04:22,1,21,80,2.76,"Not only did I have to read that, but I had to see a dog too, today is a bad day",Yes,4
post12con,controversial,deepest_subtree_KeptinGL6_level4,KeptinGL6,0,4,4,deepest_subtree_KeptinGL6_level4_comment_0011,ClaraGilmore23,4,4,2024-06-01 13:40:34,1,3,13,3.0,i love dogs :,Yes,4
post12con,controversial,deepest_subtree_KeptinGL6_level4,KeptinGL6,0,4,4,deepest_subtree_KeptinGL6_level4_comment_0012,Revelation3-16,2,2,2024-06-01 12:14:58,6,0,0,0.0,,Yes,4
post12con,controversial,deepest_subtree_KeptinGL6_level4,KeptinGL6,0,4,4,deepest_subtree_KeptinGL6_level4_comment_0013,LonelyLoser_T-T,2,2,2024-06-01 12:26:32,2,1,6,3.0,Huh???,Yes,4
post12con,controversial,deepest_subtree_KeptinGL6_level4,KeptinGL6,0,4,4,deepest_subtree_KeptinGL6_level4_comment_0014,Better_Ad2013,3,3,2024-06-01 12:29:36,1,4,27,5.25,I dont understand either...,Yes,4
post12tec,technical,deepest_subtree_prototypist_level4,prototypist,0,3,3,deepest_subtree_prototypist_level4_comment_0001,prototypist,0,0,2025-02-17 21:38:24,21,59,333,4.53,"Can you run nvidiasmi or similar command, or copy the exact error, to prove that the GPU is being fi...",Yes,4
post12tec,technical,deepest_subtree_prototypist_level4,prototypist,0,3,3,deepest_subtree_prototypist_level4_comment_0002,Solaris1712,1,1,2025-02-17 23:16:59,6,52,262,3.98,the 48gb vram is quickly filled almost immediately after I run the train command on the HF trainer o...,Yes,4
post12tec,technical,deepest_subtree_prototypist_level4,prototypist,0,3,3,deepest_subtree_prototypist_level4_comment_0003,prototypist,2,2,2025-02-17 23:26:00,11,75,465,5.05,I see in other parts that this is your first finetune and youre using the training code from the Tra...,Yes,4
post12tec,technical,deepest_subtree_prototypist_level4,prototypist,0,3,3,deepest_subtree_prototypist_level4_comment_0004,Solaris1712,3,3,2025-02-18 00:17:07,18,91,503,4.43,"THANK YOU! I did two things, i dont exactly know which one fixed my problem, but it did. I installed...",Yes,4
post13con,controversial,deepest_subtree_coyote-1_level4,coyote-1,0,4,4,deepest_subtree_coyote-1_level4_comment_0001,coyote-1,0,0,2022-11-21 08:56:26,135,172,994,4.68,There is supposedly a labor shortage. Its awfully difficult to reconcile a supposed labor shortage w...,Yes,4
post13con,controversial,deepest_subtree_coyote-1_level4,coyote-1,0,4,4,deepest_subtree_coyote-1_level4_comment_0002,Skarr87,1,1,2022-11-21 12:55:38,46,80,469,4.83,"You basically described why capitalism the way we apply it and in a generalized way, profit motive i...",Yes,4
post13con,controversial,deepest_subtree_coyote-1_level4,coyote-1,0,4,4,deepest_subtree_coyote-1_level4_comment_0003,brandonsredditname,2,2,2022-11-21 18:07:32,1,5,41,7.2,Why mitigatedelay the ultimate synthesis?,Yes,4
post13con,controversial,deepest_subtree_coyote-1_level4,coyote-1,0,4,4,deepest_subtree_coyote-1_level4_comment_0004,getdafuq,3,3,2022-11-21 22:53:12,4,4,24,5.0,Because mUh FrEe MaRkEt!,Yes,4
post13con,controversial,deepest_subtree_coyote-1_level4,coyote-1,0,4,4,deepest_subtree_coyote-1_level4_comment_0005,boxsmith91,1,1,2022-11-21 12:19:46,40,176,980,4.43,UBI wont solve anything without massive changes to our entire system. In the US and to a lesser exte...,Yes,4
post13con,controversial,deepest_subtree_coyote-1_level4,coyote-1,0,4,4,deepest_subtree_coyote-1_level4_comment_0006,Artanthos,2,2,2022-11-21 14:25:39,11,48,293,5.02,Which is why my prediction is massive barracks style dorms and cafeterias. The government will farm ...,Yes,4
post13con,controversial,deepest_subtree_coyote-1_level4,coyote-1,0,4,4,deepest_subtree_coyote-1_level4_comment_0007,Eleusis713,2,2,2022-11-21 15:48:22,6,248,1474,4.88,Areas of society like housing and rent are already dysfunctional and require their own solutions reg...,Yes,4
post13con,controversial,deepest_subtree_coyote-1_level4,coyote-1,0,4,4,deepest_subtree_coyote-1_level4_comment_0008,boxsmith91,3,3,2022-11-21 16:22:55,6,534,3069,4.63,"Im glad someone brought up the competition angle. I didnt want to make my original post too long, bu...",Yes,4
post13con,controversial,deepest_subtree_coyote-1_level4,coyote-1,0,4,4,deepest_subtree_coyote-1_level4_comment_0009,reiffschneider,2,2,2022-11-21 13:51:25,28,48,278,4.77,"The point is to move beyond capitalism and to a lesser extent dependent on currency, right? The poin...",Yes,4
post13con,controversial,deepest_subtree_coyote-1_level4,coyote-1,0,4,4,deepest_subtree_coyote-1_level4_comment_0010,louisasnotes,3,3,2022-11-21 15:58:27,13,17,103,4.94,"Nope, like everything else in our World, the point of automation is to grow profits for Multinationa...",Yes,4
post13con,controversial,deepest_subtree_coyote-1_level4,coyote-1,0,4,4,deepest_subtree_coyote-1_level4_comment_0011,WH1TERAVENs,4,4,2022-11-21 17:48:04,5,47,265,4.57,I like this comment chain. All comments have different opinions but are true to some extent. My addi...,Yes,4
post13con,controversial,deepest_subtree_coyote-1_level4,coyote-1,0,4,4,deepest_subtree_coyote-1_level4_comment_0012,RallyPointAlpha,3,3,2022-11-21 20:22:09,2,42,218,4.12,Yeah and the internet was supposed to be a digital utopia and now its a capitalistic hellscape....bu...,Yes,4
post13con,controversial,deepest_subtree_coyote-1_level4,coyote-1,0,4,4,deepest_subtree_coyote-1_level4_comment_0013,DrTwitch,3,3,2022-11-21 16:23:02,1,28,169,4.93,"Everyone wants to talk about the point, but thats just the public talking points. The people impleme...",Yes,4
post13con,controversial,deepest_subtree_coyote-1_level4,coyote-1,0,4,4,deepest_subtree_coyote-1_level4_comment_0014,Southern-Trip-1102,2,2,2022-11-21 13:52:56,10,5,28,4.6,All roads lead to socialism.,Yes,4
post13con,controversial,deepest_subtree_coyote-1_level4,coyote-1,0,4,4,deepest_subtree_coyote-1_level4_comment_0015,julianwelton,3,3,2022-11-21 14:51:29,12,78,417,4.24,Youd hope but whats more likely to happen is a The Expanse scenario The 1 are rich while everyone el...,Yes,4
post13con,controversial,deepest_subtree_coyote-1_level4,coyote-1,0,4,4,deepest_subtree_coyote-1_level4_comment_0016,rainpizza,4,4,2022-11-21 19:47:53,0,49,286,4.8,The problem that the dude SouthernTrip is not addressing is the fact that socialism is basically lik...,Yes,4
post13con,controversial,deepest_subtree_coyote-1_level4,coyote-1,0,4,4,deepest_subtree_coyote-1_level4_comment_0017,Southern-Trip-1102,4,4,2022-11-21 14:54:11,-1,15,92,5.13,That would be the case if capitlaism didnt self destruct economically even without a revolt.,Yes,4
post13con,controversial,deepest_subtree_coyote-1_level4,coyote-1,0,4,4,deepest_subtree_coyote-1_level4_comment_0018,Artanthos,3,3,2022-11-21 14:27:00,5,9,45,4.0,Or a plutocracy with 90 living in a dystopia.,Yes,4
post13con,controversial,deepest_subtree_coyote-1_level4,coyote-1,0,4,4,deepest_subtree_coyote-1_level4_comment_0019,Direct-Effective2694,4,4,2022-11-21 14:57:08,5,59,316,4.32,The capitalists had better hope they do better than that or theyre not going to be around for long. ...,Yes,4
post13con,controversial,deepest_subtree_coyote-1_level4,coyote-1,0,4,4,deepest_subtree_coyote-1_level4_comment_0020,unculturedburnttoast,4,4,2022-11-21 17:39:36,3,32,214,5.56,"Plutocracy, and other forms of authoritarianism, always have an Achilles heel, often that they belie...",Yes,4
post13con,controversial,deepest_subtree_coyote-1_level4,coyote-1,0,4,4,deepest_subtree_coyote-1_level4_comment_0021,Southern-Trip-1102,4,4,2022-11-21 14:30:02,2,24,143,4.88,One would think but capitlaism has multiple self destructing phenomena. Search up the falling rate o...,Yes,4
post13con,controversial,deepest_subtree_coyote-1_level4,coyote-1,0,4,4,deepest_subtree_coyote-1_level4_comment_0022,rainpizza,3,3,2022-11-21 19:04:32,0,28,151,4.36,As long as wealth and power doesnt concentrate in a few handsas we have seen multiple times in socia...,Yes,4
post13con,controversial,deepest_subtree_coyote-1_level4,coyote-1,0,4,4,deepest_subtree_coyote-1_level4_comment_0023,raybanshee,2,2,2022-11-21 13:45:30,0,14,78,4.5,Well said. Every member of the antiwork subreddit should be made to read this.,Yes,4
post13con,controversial,deepest_subtree_coyote-1_level4,coyote-1,0,4,4,deepest_subtree_coyote-1_level4_comment_0024,ionstorm20,3,3,2022-11-21 14:38:43,2,25,132,4.24,I think you need to read the antiwork subreddit. Id be willing to bet 99 of them want the massive ch...,Yes,4
post13con,controversial,deepest_subtree_coyote-1_level4,coyote-1,0,4,4,deepest_subtree_coyote-1_level4_comment_0025,raybanshee,4,4,2022-11-21 15:12:07,2,55,306,4.49,"Ok yes, I agree that the tear it all down sentiment is strong over there, however there is an appall...",Yes,4
post13con,controversial,deepest_subtree_coyote-1_level4,coyote-1,0,4,4,deepest_subtree_coyote-1_level4_comment_0026,getdafuq,2,2,2022-11-21 22:54:16,1,20,110,4.45,"Even if the prices go up, being able to afford something is vastly preferable to being able to affor...",Yes,4
post13con,controversial,deepest_subtree_coyote-1_level4,coyote-1,0,4,4,deepest_subtree_coyote-1_level4_comment_0027,fhsoownfjff,2,2,2022-11-22 02:05:14,1,49,298,4.96,"Food prices wont increase. If they do, people with capital start food businesses to reap profits due...",Yes,4
post13con,controversial,deepest_subtree_coyote-1_level4,coyote-1,0,4,4,deepest_subtree_coyote-1_level4_comment_0028,Ark-kun,2,2,2022-11-22 02:07:16,1,21,102,3.86,Why is it 1000 and not say 0.1 of total propertywealth divided by the number of people in the countr...,Yes,4
post13con,controversial,deepest_subtree_coyote-1_level4,coyote-1,0,4,4,deepest_subtree_coyote-1_level4_comment_0029,boxsmith91,3,3,2022-11-22 02:18:21,1,30,171,4.6,"1000 is what Andrew yang campaigned on during his 2020 run. The number doesnt really matter, it was ...",Yes,4
post13con,controversial,deepest_subtree_coyote-1_level4,coyote-1,0,4,4,deepest_subtree_coyote-1_level4_comment_0030,Ark-kun,4,4,2022-11-22 02:24:00,1,28,147,4.18,I do not think so. Please prove that UBI proportional to total citizen wealth is equivalent to fixed...,Yes,4
post13con,controversial,deepest_subtree_coyote-1_level4,coyote-1,0,4,4,deepest_subtree_coyote-1_level4_comment_0031,Southern-Trip-1102,1,1,2022-11-21 11:51:09,9,27,149,4.41,"If history is any measure, they arent going to implement a UBI. The rulling classes of times past al...",Yes,4
post13con,controversial,deepest_subtree_coyote-1_level4,coyote-1,0,4,4,deepest_subtree_coyote-1_level4_comment_0032,Artanthos,2,2,2022-11-21 14:28:19,3,17,107,5.24,The ruling classes of the past didnt have automatic weapons. Or autonomous robots armed with those w...,Yes,4
post13con,controversial,deepest_subtree_coyote-1_level4,coyote-1,0,4,4,deepest_subtree_coyote-1_level4_comment_0033,Southern-Trip-1102,3,3,2022-11-21 14:31:37,3,29,168,4.76,True however the same technology that allows a single person to control an entire army is the same t...,Yes,4
post13con,controversial,deepest_subtree_coyote-1_level4,coyote-1,0,4,4,deepest_subtree_coyote-1_level4_comment_0034,Artanthos,4,4,2022-11-21 14:35:14,1,8,45,4.62,You dont need AGI to have autonomous systems.,Yes,4
post13con,controversial,deepest_subtree_coyote-1_level4,coyote-1,0,4,4,deepest_subtree_coyote-1_level4_comment_0035,HourWorking2839,1,1,2022-11-21 10:47:10,9,10,68,5.9,incoherent mumbling about first mover advantage and a shoulder shrug,Yes,4
post13con,controversial,deepest_subtree_coyote-1_level4,coyote-1,0,4,4,deepest_subtree_coyote-1_level4_comment_0036,TheOneAllFear,1,1,2022-11-21 15:53:45,2,210,1129,4.31,Your conclusion is not true. It will take time but low skilled jobs of that kind will dissapear. One...,Yes,4
post13con,controversial,deepest_subtree_coyote-1_level4,coyote-1,0,4,4,deepest_subtree_coyote-1_level4_comment_0037,Kimorin,1,1,2022-11-21 11:23:16,3,66,386,4.74,not really... there is a labor shortage BECAUSE automation is driving cost of production down. autom...,Yes,4
post13con,controversial,deepest_subtree_coyote-1_level4,coyote-1,0,4,4,deepest_subtree_coyote-1_level4_comment_0038,r33c3d,2,2,2022-11-21 11:26:59,7,27,180,5.59,Companies would probably be smart to train their displaced workers with skills they can apply to thi...,Yes,4
post13con,controversial,deepest_subtree_coyote-1_level4,coyote-1,0,4,4,deepest_subtree_coyote-1_level4_comment_0039,Kimorin,3,3,2022-11-21 11:30:36,5,21,125,4.62,i would be smart.... but its a long term benefit with short term expenses... businesses usually are ...,Yes,4
post13con,controversial,deepest_subtree_coyote-1_level4,coyote-1,0,4,4,deepest_subtree_coyote-1_level4_comment_0040,r33c3d,4,4,2022-11-21 11:34:29,3,52,287,4.48,I remember reading that most advanced assembly line work which is what we need requires employees to...,Yes,4
post13con,controversial,deepest_subtree_coyote-1_level4,coyote-1,0,4,4,deepest_subtree_coyote-1_level4_comment_0041,OrangeJr36,3,3,2022-11-21 12:19:00,5,87,543,5.14,Workers and voters themselves vote against such plans constantly. Job retraining is extremely unpopu...,Yes,4
post13con,controversial,deepest_subtree_coyote-1_level4,coyote-1,0,4,4,deepest_subtree_coyote-1_level4_comment_0042,r33c3d,4,4,2022-11-21 13:22:55,3,52,292,4.52,Yeah. I used to work as a union librarian. There were coworkers that refused to use a computer and c...,Yes,4
post13con,controversial,deepest_subtree_coyote-1_level4,coyote-1,0,4,4,deepest_subtree_coyote-1_level4_comment_0043,Artanthos,3,3,2022-11-21 14:30:12,1,17,94,4.41,"Some companies do. Granted, they are the exception and it can be difficult to get hired there.",Yes,4
post13con,controversial,deepest_subtree_coyote-1_level4,coyote-1,0,4,4,deepest_subtree_coyote-1_level4_comment_0044,scurvofpcp,3,3,2022-11-21 14:40:30,1,75,405,4.36,It is hard to say this without being controversial but many people end up in service jobs because th...,Yes,4
post13con,controversial,deepest_subtree_coyote-1_level4,coyote-1,0,4,4,deepest_subtree_coyote-1_level4_comment_0045,raybanshee,1,1,2022-11-21 13:44:16,-2,5,27,4.4,Andrew Yang knows whats up.,Yes,4
post13con,controversial,deepest_subtree_coyote-1_level4,coyote-1,0,4,4,deepest_subtree_coyote-1_level4_comment_0046,Deleted,1,1,2022-11-22 08:54:39,1,55,338,5.09,One more important factor would be countries which are democratic and which arent. In a democracy po...,Yes,4
post14con,controversial,deepest_subtree_Objective-Advisor1_level4,Objective-Advisor1,0,4,4,deepest_subtree_Objective-Advisor1_level4_comment_0001,Objective-Advisor1,0,0,2025-01-14 00:36:33,475,108,623,4.69,Dont forget how much AI leadership loves to tout how many jobs it will replace. They do this to enti...,Yes,4
post14con,controversial,deepest_subtree_Objective-Advisor1_level4,Objective-Advisor1,0,4,4,deepest_subtree_Objective-Advisor1_level4_comment_0002,Fickle_Competition33,1,1,2025-01-14 09:44:54,102,57,333,4.72,"Its been like this with automation, then cloud computing, now AI: This amazing technology will make ...",Yes,4
post14con,controversial,deepest_subtree_Objective-Advisor1_level4,Objective-Advisor1,0,4,4,deepest_subtree_Objective-Advisor1_level4_comment_0003,krileon,2,2,2025-01-14 12:23:43,33,70,419,4.9,Whats funny is they learned nothing from cloud services. Which basically were free initially. Then c...,Yes,4
post14con,controversial,deepest_subtree_Objective-Advisor1_level4,Objective-Advisor1,0,4,4,deepest_subtree_Objective-Advisor1_level4_comment_0004,FordPrefect343,3,3,2025-01-14 15:05:40,9,192,1024,4.24,"You are taking Altmans words at face value, which you shouldnt do. The reason 200 a month is potenti...",Yes,4
post14con,controversial,deepest_subtree_Objective-Advisor1_level4,Objective-Advisor1,0,4,4,deepest_subtree_Objective-Advisor1_level4_comment_0005,Reflectioneer,3,3,2025-01-14 14:35:41,13,23,139,5.0,Open source alternatives are already available at a fraction of the cost. Theres no way OpenAI can m...,Yes,4
post14con,controversial,deepest_subtree_Objective-Advisor1_level4,Objective-Advisor1,0,4,4,deepest_subtree_Objective-Advisor1_level4_comment_0006,krileon,4,4,2025-01-14 14:42:49,6,50,262,4.12,Vast majority of businesses are not going to host their own local model. They dont want to have to d...,Yes,4
post14con,controversial,deepest_subtree_Objective-Advisor1_level4,Objective-Advisor1,0,4,4,deepest_subtree_Objective-Advisor1_level4_comment_0007,Deleted,4,4,2025-01-14 23:15:36,3,79,444,4.52,"Thats why big companies all use products like Azure and Office when free alternatives exist, right? ...",Yes,4
post14con,controversial,deepest_subtree_Objective-Advisor1_level4,Objective-Advisor1,0,4,4,deepest_subtree_Objective-Advisor1_level4_comment_0008,01000101010110,3,3,2025-01-14 14:20:12,3,44,235,4.27,ChatGPT has reached the point of no return. It has become so ingrained in our lives at this point th...,Yes,4
post14con,controversial,deepest_subtree_Objective-Advisor1_level4,Objective-Advisor1,0,4,4,deepest_subtree_Objective-Advisor1_level4_comment_0009,cooperdale,4,4,2025-01-14 21:47:47,5,59,308,4.12,Im curious what people use it for in their day to day lives? Ive never purposely used chat gpt for a...,Yes,4
post14con,controversial,deepest_subtree_Objective-Advisor1_level4,Objective-Advisor1,0,4,4,deepest_subtree_Objective-Advisor1_level4_comment_0010,FrumiousShuckyDuck,4,4,2025-01-15 08:10:54,2,10,41,3.1,Yeah I dont use ChatGPT in my day to day.,Yes,4
post14con,controversial,deepest_subtree_Objective-Advisor1_level4,Objective-Advisor1,0,4,4,deepest_subtree_Objective-Advisor1_level4_comment_0011,WinterHill,2,2,2025-01-14 10:28:20,34,106,621,4.75,Yes! But its not going to have the impact they say it will. Having worked on many software projects ...,Yes,4
post14con,controversial,deepest_subtree_Objective-Advisor1_level4,Objective-Advisor1,0,4,4,deepest_subtree_Objective-Advisor1_level4_comment_0012,jrob323,3,3,2025-01-14 12:35:02,6,57,329,4.6,Managing peoplethe client is often more work that implementing the software itself. Thatll never go ...,Yes,4
post14con,controversial,deepest_subtree_Objective-Advisor1_level4,Objective-Advisor1,0,4,4,deepest_subtree_Objective-Advisor1_level4_comment_0013,grantedtoast,3,3,2025-01-14 17:05:19,2,30,153,4.1,Especially since the average end user at a lot of companies is somewhere between as tech savvy as a ...,Yes,4
post14con,controversial,deepest_subtree_Objective-Advisor1_level4,Objective-Advisor1,0,4,4,deepest_subtree_Objective-Advisor1_level4_comment_0014,01000101010110,2,2,2025-01-14 14:18:49,3,49,278,4.63,I used to sell field service management platforms to contractors and eventually it dawned on me that...,Yes,4
