parent_post_id,conversation_type,subtree_id,subtree_root_author,subtree_root_depth,subtree_max_depth,subtree_depth_span,comment_id,author,normalized_depth,original_depth,timestamp,score,word_count,character_count,avg_word_length,cleaned_text_sample,depth_cap_applied,max_depth_analyzed
post24con,controversial,deepest_subtree_AaahhFakeMonsters_level4,AaahhFakeMonsters,0,4,4,deepest_subtree_AaahhFakeMonsters_level4_comment_0001,AaahhFakeMonsters,0,0,2019-12-19 17:54:03,39,142,854,4.95,Facial recognition software misidentifies nonwhite people more frequently than white people. Which m...,Yes,4
post24con,controversial,deepest_subtree_AaahhFakeMonsters_level4,AaahhFakeMonsters,0,4,4,deepest_subtree_AaahhFakeMonsters_level4_comment_0002,MasterFubar,1,1,2019-12-19 19:26:11,14,183,1013,4.46,"Of course not, but at least it narrows down the number of suspects the police must investigate. No o...",Yes,4
post24con,controversial,deepest_subtree_AaahhFakeMonsters_level4,AaahhFakeMonsters,0,4,4,deepest_subtree_AaahhFakeMonsters_level4_comment_0003,2wheeloffroad,2,2,2019-12-19 19:52:22,7,58,299,4.07,"Look at the Big Brain on MasterFubar. Finally someone who gets it. And, the reason is that the FR is...",Yes,4
post24con,controversial,deepest_subtree_AaahhFakeMonsters_level4,AaahhFakeMonsters,0,4,4,deepest_subtree_AaahhFakeMonsters_level4_comment_0004,speckospock,2,2,2019-12-19 22:30:57,3,56,307,4.39,"If we dont ask this question, we run the risk of encoding current bias into algorithms, even if its ...",Yes,4
post24con,controversial,deepest_subtree_AaahhFakeMonsters_level4,AaahhFakeMonsters,0,4,4,deepest_subtree_AaahhFakeMonsters_level4_comment_0005,Kannoj0,2,2,2019-12-19 19:50:11,1,23,125,4.3,"But by this logic, teslas should be able to drive me everywhere right ? As Im sure theyve wrecked mu...",Yes,4
post24con,controversial,deepest_subtree_AaahhFakeMonsters_level4,AaahhFakeMonsters,0,4,4,deepest_subtree_AaahhFakeMonsters_level4_comment_0006,MasterFubar,3,3,2019-12-19 19:59:25,1,25,157,5.16,"Actually, no. Considering the amount of fatal accidents people have had with Teslas, there is no sta...",Yes,4
post24con,controversial,deepest_subtree_AaahhFakeMonsters_level4,AaahhFakeMonsters,0,4,4,deepest_subtree_AaahhFakeMonsters_level4_comment_0007,Kannoj0,4,4,2019-12-19 20:27:34,1,100,540,4.33,Does that number and the accompanying efficacy beat the current mortality rate ? The right metric to...,Yes,4
post24con,controversial,deepest_subtree_AaahhFakeMonsters_level4,AaahhFakeMonsters,0,4,4,deepest_subtree_AaahhFakeMonsters_level4_comment_0008,LadyEmVee,2,2,2019-12-19 22:03:06,0,9,47,4.11,Youre wrong. That is the exact question to ask.,Yes,4
post24con,controversial,deepest_subtree_AaahhFakeMonsters_level4,AaahhFakeMonsters,0,4,4,deepest_subtree_AaahhFakeMonsters_level4_comment_0009,Andyroo1986,1,1,2019-12-20 01:54:41,0,71,426,4.9,"The issue with the headline here is the word biased. Bias is defined by prejudice, which implies a p...",Yes,4
post24con,controversial,deepest_subtree_AaahhFakeMonsters_level4,AaahhFakeMonsters,0,4,4,deepest_subtree_AaahhFakeMonsters_level4_comment_0010,AaahhFakeMonsters,2,2,2019-12-20 08:15:46,-1,67,389,4.75,Im able to have a conversation about it despite the semantics of the headline. The fact that you are...,Yes,4
post24con,controversial,deepest_subtree_AaahhFakeMonsters_level4,AaahhFakeMonsters,0,4,4,deepest_subtree_AaahhFakeMonsters_level4_comment_0011,Andyroo1986,3,3,2019-12-20 17:33:56,0,3,13,3.67,Read it again,Yes,4
post24con,controversial,deepest_subtree_AaahhFakeMonsters_level4,AaahhFakeMonsters,0,4,4,deepest_subtree_AaahhFakeMonsters_level4_comment_0012,AaahhFakeMonsters,4,4,2019-12-20 17:34:51,1,17,91,4.24,"How should the technology be used, in your opinion? What is acceptable use and what is not?",Yes,4
post24tec,technical,deepest_subtree_herozorro_level4,herozorro,0,4,4,deepest_subtree_herozorro_level4_comment_0001,herozorro,0,0,2023-11-06 15:06:53,3,20,92,3.55,can this run on a local M116gig. or is this suppposed to be done on a pay for compute place?,Yes,4
post24tec,technical,deepest_subtree_herozorro_level4,herozorro,0,4,4,deepest_subtree_herozorro_level4_comment_0002,Amgadoz,1,1,2023-11-06 16:17:42,2,14,60,3.29,"If its a qlora, you can try it on the free T4 colab notebook",Yes,4
post24tec,technical,deepest_subtree_herozorro_level4,herozorro,0,4,4,deepest_subtree_herozorro_level4_comment_0003,herozorro,2,2,2023-11-06 16:27:19,1,34,176,4.12,what is the final output that you can take with you to use locally? i thought the collab compute are...,Yes,4
post24tec,technical,deepest_subtree_herozorro_level4,herozorro,0,4,4,deepest_subtree_herozorro_level4_comment_0004,Amgadoz,3,3,2023-11-06 16:42:46,2,25,130,4.16,You can download the finetuned model to use it however you want. You can also save it in your google...,Yes,4
post24tec,technical,deepest_subtree_herozorro_level4,herozorro,0,4,4,deepest_subtree_herozorro_level4_comment_0005,herozorro,4,4,2023-11-06 17:20:35,1,6,31,4.33,thank you for your many replies,Yes,4
post25con,controversial,deepest_subtree_cyrusposting_level4,cyrusposting,0,4,4,deepest_subtree_cyrusposting_level4_comment_0001,cyrusposting,0,0,2024-04-17 11:24:32,9,337,1901,4.58,These researchers were investigating a bug in large language models and along the way developed a te...,Yes,4
post25con,controversial,deepest_subtree_cyrusposting_level4,cyrusposting,0,4,4,deepest_subtree_cyrusposting_level4_comment_0002,Send_Me_Your_Birbs,1,1,2024-04-17 12:14:29,7,85,478,4.51,"As far as I know, Word2Vec is the common technique for representing words as tokens and mapping the ...",Yes,4
post25con,controversial,deepest_subtree_cyrusposting_level4,cyrusposting,0,4,4,deepest_subtree_cyrusposting_level4_comment_0003,cyrusposting,2,2,2024-04-17 14:13:58,2,14,82,4.79,"Alignment is not specifically an AGI problem, a chatbot can be misaligned as well.",Yes,4
post25con,controversial,deepest_subtree_cyrusposting_level4,cyrusposting,0,4,4,deepest_subtree_cyrusposting_level4_comment_0004,Send_Me_Your_Birbs,3,3,2024-04-17 15:00:11,3,24,114,3.67,"Right, I reread and I think I see what you mean. The tool is not actually solving for the problem we...",Yes,4
post25con,controversial,deepest_subtree_cyrusposting_level4,cyrusposting,0,4,4,deepest_subtree_cyrusposting_level4_comment_0005,cyrusposting,4,4,2024-04-17 15:37:55,2,45,224,3.96,Yeah my post is messy but the point Im generally trying to make is that while OP names an issue that...,Yes,4
post25con,controversial,deepest_subtree_cyrusposting_level4,cyrusposting,0,4,4,deepest_subtree_cyrusposting_level4_comment_0006,Raileyx,1,1,2024-04-17 13:36:53,2,252,1462,4.7,"to be more precise, these arent tokens that are closely related in the semantic sense that would jus...",Yes,4
post25con,controversial,deepest_subtree_cyrusposting_level4,cyrusposting,0,4,4,deepest_subtree_cyrusposting_level4_comment_0007,cyrusposting,2,2,2024-04-17 15:31:46,4,200,1142,4.62,It shows that the language model has come to understand that the word girl should often follow the w...,Yes,4
post25con,controversial,deepest_subtree_cyrusposting_level4,cyrusposting,0,4,4,deepest_subtree_cyrusposting_level4_comment_0008,Raileyx,3,3,2024-04-17 18:07:17,0,514,2846,4.42,oooh Ive actually read that one before  really interesting stuff. I took kind of a similar view on i...,Yes,4
post25con,controversial,deepest_subtree_cyrusposting_level4,cyrusposting,0,4,4,deepest_subtree_cyrusposting_level4_comment_0009,cyrusposting,4,4,2024-04-17 20:04:25,2,507,2861,4.56,"I hope Im being clear enough that we cant say very much for sure yet, because AI interpretability is...",Yes,4
post25con,controversial,deepest_subtree_cyrusposting_level4,cyrusposting,0,4,4,deepest_subtree_cyrusposting_level4_comment_0010,georgejo314159,1,1,2024-04-17 13:26:18,1,3,16,4.33,Thanks for this.,Yes,4
post25tec,technical,deepest_subtree_kaiokendev_level4,kaiokendev,0,4,4,deepest_subtree_kaiokendev_level4_comment_0001,kaiokendev,0,0,2023-07-04 03:44:53,21,230,1182,4.07,"I can only speak personally, but I never used it because:  4bit GPTQ LoRA training was available sin...",Yes,4
post25tec,technical,deepest_subtree_kaiokendev_level4,kaiokendev,0,4,4,deepest_subtree_kaiokendev_level4_comment_0002,tronathan,1,1,2023-07-04 04:32:12,7,19,107,4.58,afaik alpaca_lora_4bit is also roughly twice as fast. thats a pretty damn good reason to use it over...,Yes,4
post25tec,technical,deepest_subtree_kaiokendev_level4,kaiokendev,0,4,4,deepest_subtree_kaiokendev_level4_comment_0003,georgesung,1,1,2023-07-04 14:45:30,3,181,1034,4.61,"Is the rank of the original weight matrix just the smallest dimension of the matrix? E.g. The Q, K, ...",Yes,4
post25tec,technical,deepest_subtree_kaiokendev_level4,kaiokendev,0,4,4,deepest_subtree_kaiokendev_level4_comment_0004,kaiokendev,2,2,2023-07-04 15:07:33,1,30,177,4.83,I think your confusion is the trainable parameters? You do not need to copy the weight matrices enti...,Yes,4
post25tec,technical,deepest_subtree_kaiokendev_level4,kaiokendev,0,4,4,deepest_subtree_kaiokendev_level4_comment_0005,georgesung,3,3,2023-07-04 15:17:02,2,87,488,4.54,I guess I was confused when you said LoRA with rank equal to the rank of the weight matrix is equiva...,Yes,4
post25tec,technical,deepest_subtree_kaiokendev_level4,kaiokendev,0,4,4,deepest_subtree_kaiokendev_level4_comment_0006,kaiokendev,4,4,2023-07-04 15:23:52,3,51,258,4.0,"Yes sorry! My mistake, I meant when rank is equal to the full rank of the weight matrices. The LoRA ...",Yes,4
post25tec,technical,deepest_subtree_kaiokendev_level4,kaiokendev,0,4,4,deepest_subtree_kaiokendev_level4_comment_0007,Mysterious_Brush3508,1,1,2023-07-04 06:21:59,2,11,63,4.73,What rank and alpha are you using for your training kaiokendev?,Yes,4
post25tec,technical,deepest_subtree_kaiokendev_level4,kaiokendev,0,4,4,deepest_subtree_kaiokendev_level4_comment_0008,kaiokendev,2,2,2023-07-04 06:33:34,6,74,360,3.76,"Rank  4 and alpha of 8, maybe rank  2 in some cases. It seem low but according to the LoRA paper, ex...",Yes,4
post25tec,technical,deepest_subtree_kaiokendev_level4,kaiokendev,0,4,4,deepest_subtree_kaiokendev_level4_comment_0009,a_beautiful_rhind,3,3,2023-07-04 07:30:58,2,22,134,5.05,This explains why my alpha 128rank 256 ballooned the adapter so much. Raising those did make the des...,Yes,4
post25tec,technical,deepest_subtree_kaiokendev_level4,kaiokendev,0,4,4,deepest_subtree_kaiokendev_level4_comment_0010,FPham,4,4,2023-07-04 12:45:17,1,11,40,2.73,did you use all 7 layers or just Q and V,Yes,4
post25tec,technical,deepest_subtree_kaiokendev_level4,kaiokendev,0,4,4,deepest_subtree_kaiokendev_level4_comment_0011,Mysterious_Brush3508,3,3,2023-07-04 07:06:58,1,1,7,6.0,Thanks!,Yes,4
post25tec,technical,deepest_subtree_kaiokendev_level4,kaiokendev,0,4,4,deepest_subtree_kaiokendev_level4_comment_0012,FPham,1,1,2023-07-04 10:57:09,1,82,425,3.99,"I did a lot of old 4bit LoRA and QLora and the result is ..... same. Not exactly same, but same in t...",Yes,4
post25tec,technical,deepest_subtree_kaiokendev_level4,kaiokendev,0,4,4,deepest_subtree_kaiokendev_level4_comment_0013,kaiokendev,2,2,2023-07-04 15:10:17,1,47,220,3.64,"Yeah it would be 5120 in the case of 13B, 6144 in case of 30B, but the point of the paper is that th...",Yes,4
post25tec,technical,deepest_subtree_kaiokendev_level4,kaiokendev,0,4,4,deepest_subtree_kaiokendev_level4_comment_0014,FPham,3,3,2023-07-04 16:19:28,1,1,7,6.0,Gotcha!,Yes,4
post25tec,technical,deepest_subtree_kaiokendev_level4,kaiokendev,0,4,4,deepest_subtree_kaiokendev_level4_comment_0015,generalDevelopmentAc,1,1,2023-07-05 03:37:46,1,137,789,4.69,"Not sure if you missed it, but the whole main point of qlora is that you can get basically same qual...",Yes,4
post25tec,technical,deepest_subtree_kaiokendev_level4,kaiokendev,0,4,4,deepest_subtree_kaiokendev_level4_comment_0016,kaiokendev,2,2,2023-07-05 04:36:29,2,186,1016,4.39,"Yes, I am saying that this is already achievable with the 4bit LoRA trainer, so using QLoRA did not ...",Yes,4
post25tec,technical,deepest_subtree_kaiokendev_level4,kaiokendev,0,4,4,deepest_subtree_kaiokendev_level4_comment_0017,generalDevelopmentAc,3,3,2023-07-06 01:15:12,1,108,650,4.94,Do you have a link for the 4bit Lora trainer? Would love to check it out. My comment about additiona...,Yes,4
post25tec,technical,deepest_subtree_kaiokendev_level4,kaiokendev,0,4,4,deepest_subtree_kaiokendev_level4_comment_0018,kaiokendev,4,4,2023-07-06 01:55:48,1,5,19,2.8,Here is link to it:,Yes,4
post25tec,technical,deepest_subtree_kaiokendev_level4,kaiokendev,0,4,4,deepest_subtree_kaiokendev_level4_comment_0019,Technical-Owl3342,1,1,2023-09-20 16:13:52,1,11,66,5.0,have you compared the efficiency of lora 4bit compared with qlora?,Yes,4
post26con,controversial,deepest_subtree_-happycow-_level4,-happycow-,0,4,4,deepest_subtree_-happycow-_level4_comment_0001,-happycow-,0,0,2025-04-13 18:12:01,112,4,22,4.25,"worsen, by far worsen.",Yes,4
post26con,controversial,deepest_subtree_-happycow-_level4,-happycow-,0,4,4,deepest_subtree_-happycow-_level4_comment_0002,abrandis,1,1,2025-04-13 18:19:33,11,23,123,4.09,"Yep, agree totally worse. It ,nas it will be used by those that own the tech, resources and land to ...",Yes,4
post26con,controversial,deepest_subtree_-happycow-_level4,-happycow-,0,4,4,deepest_subtree_-happycow-_level4_comment_0003,Beginning-Shop-6731,1,1,2025-04-13 19:13:40,6,25,140,4.52,Yeah its only going to exaggerate pre existing trends of income inequality. If you mean by equality ...,Yes,4
post26con,controversial,deepest_subtree_-happycow-_level4,-happycow-,0,4,4,deepest_subtree_-happycow-_level4_comment_0004,East-Worry-9358,1,1,2025-04-14 10:13:32,3,111,594,4.26,Imagine a world where labor is only only as scarce as the number of robots. And you thought globaliz...,Yes,4
post26con,controversial,deepest_subtree_-happycow-_level4,-happycow-,0,4,4,deepest_subtree_-happycow-_level4_comment_0005,-happycow-,2,2,2025-04-14 10:18:06,2,85,454,4.21,What do you think will happen when we reach a critical mass of unhireable people? They dont have mon...,Yes,4
post26con,controversial,deepest_subtree_-happycow-_level4,-happycow-,0,4,4,deepest_subtree_-happycow-_level4_comment_0006,East-Worry-9358,3,3,2025-04-14 10:41:55,2,98,551,4.51,Agreed. And then they have a choice  either accept death or fight back. Hopefully it doesnt come to ...,Yes,4
post26con,controversial,deepest_subtree_-happycow-_level4,-happycow-,0,4,4,deepest_subtree_-happycow-_level4_comment_0007,-happycow-,4,4,2025-04-14 10:50:33,2,90,479,4.16,"We are certainly reaching an inflection point where either AI, controlled by the elite, wins, or the...",Yes,4
post26con,controversial,deepest_subtree_-happycow-_level4,-happycow-,0,4,4,deepest_subtree_-happycow-_level4_comment_0008,dofwifpartyhat,3,3,2025-04-17 08:59:14,1,28,152,4.39,the peasants have been required for the last 10000 years to get the elites to the singularity. AI an...,Yes,4
post26con,controversial,deepest_subtree_-happycow-_level4,-happycow-,0,4,4,deepest_subtree_-happycow-_level4_comment_0009,odious_as_fuck,1,1,2025-04-13 18:14:35,-4,32,185,4.69,"How come? Assuming they have access to Ai, couldnt it help make education and medical information mo...",Yes,4
post26con,controversial,deepest_subtree_-happycow-_level4,-happycow-,0,4,4,deepest_subtree_-happycow-_level4_comment_0010,-happycow-,2,2,2025-04-13 18:24:35,37,17,98,4.76,Because the people who can afford unlimited compute are the ones who control what the AI produces.,Yes,4
post26con,controversial,deepest_subtree_-happycow-_level4,-happycow-,0,4,4,deepest_subtree_-happycow-_level4_comment_0011,IAMAPrisoneroftheSun,2,2,2025-04-13 18:58:28,22,13,70,4.38,Because we dont live in a society that distributes wealth at all well.,Yes,4
post26con,controversial,deepest_subtree_-happycow-_level4,-happycow-,0,4,4,deepest_subtree_-happycow-_level4_comment_0012,odious_as_fuck,3,3,2025-04-13 19:09:50,5,18,107,4.89,That is true. Does it follow then that this ultimately accelerates our need to reform our economic s...,Yes,4
post26con,controversial,deepest_subtree_-happycow-_level4,-happycow-,0,4,4,deepest_subtree_-happycow-_level4_comment_0013,IAMAPrisoneroftheSun,4,4,2025-04-13 19:47:29,14,167,949,4.6,"Im honestly afraid we are already so far behind on reform, given the scale of the task of reworking ...",Yes,4
post26con,controversial,deepest_subtree_-happycow-_level4,-happycow-,0,4,4,deepest_subtree_-happycow-_level4_comment_0014,Soggy_Ad7165,4,4,2025-04-14 01:17:53,3,62,346,4.53,The people who have the power to change the system profit the most from the system. Its a fundamenta...,Yes,4
post26con,controversial,deepest_subtree_-happycow-_level4,-happycow-,0,4,4,deepest_subtree_-happycow-_level4_comment_0015,ghosty4567,3,3,2025-04-13 20:38:10,3,21,134,5.29,Yet. First the power and wealth becomes more concentrated then the reaction politically. Humanity ju...,Yes,4
post26con,controversial,deepest_subtree_-happycow-_level4,-happycow-,0,4,4,deepest_subtree_-happycow-_level4_comment_0016,abrandis,2,2,2025-04-13 18:22:20,8,43,259,4.86,"Power comes from econoonc potential aka capital, having more education is worthless if your labor is...",Yes,4
post26con,controversial,deepest_subtree_-happycow-_level4,-happycow-,0,4,4,deepest_subtree_-happycow-_level4_comment_0017,uresmane,2,2,2025-04-13 21:32:56,4,22,124,4.64,Whats the point in accessible education or medical information if you dont have a house anymore cuz ...,Yes,4
post26con,controversial,deepest_subtree_-happycow-_level4,-happycow-,0,4,4,deepest_subtree_-happycow-_level4_comment_0018,odious_as_fuck,3,3,2025-04-14 04:21:26,1,2,9,4.0,Very true,Yes,4
post26con,controversial,deepest_subtree_-happycow-_level4,-happycow-,0,4,4,deepest_subtree_-happycow-_level4_comment_0019,Larsmeatdragon,2,2,2025-04-13 18:29:14,2,172,1045,5.01,"A few nobel laureates discussed it here Essentially if we look at the history of automation, in the ...",Yes,4
post26con,controversial,deepest_subtree_-happycow-_level4,-happycow-,0,4,4,deepest_subtree_-happycow-_level4_comment_0020,odious_as_fuck,3,3,2025-04-13 18:34:16,1,12,64,4.33,"Thank you this is really interesting, Ill give that link a watch",Yes,4
post26con,controversial,deepest_subtree_-happycow-_level4,-happycow-,0,4,4,deepest_subtree_-happycow-_level4_comment_0021,-happycow-,3,3,2025-04-13 18:38:05,-2,83,435,4.12,"Youre literally behind, and misunderstanding AI, if you compare this to automation. Just off the bat...",Yes,4
post26con,controversial,deepest_subtree_-happycow-_level4,-happycow-,0,4,4,deepest_subtree_-happycow-_level4_comment_0022,odious_as_fuck,4,4,2025-04-13 18:44:50,0,32,176,4.47,May I ask what your understanding is? Are you saying there is no way in which ai will help the commo...,Yes,4
post26con,controversial,deepest_subtree_-happycow-_level4,-happycow-,0,4,4,deepest_subtree_-happycow-_level4_comment_0023,mulligan_sullivan,2,2,2025-04-13 21:08:09,2,38,218,4.71,Its ownership of significant money to invest in business or stocks etc that allows wealth accumulati...,Yes,4
post26con,controversial,deepest_subtree_-happycow-_level4,-happycow-,0,4,4,deepest_subtree_-happycow-_level4_comment_0024,ezkeles,2,2,2025-04-13 21:45:30,2,31,179,4.55,not everyone can access best AI didnt chatgpt now need 200 dollar a month to access that? and need a...,Yes,4
post26con,controversial,deepest_subtree_-happycow-_level4,-happycow-,0,4,4,deepest_subtree_-happycow-_level4_comment_0025,Quomii,3,3,2025-04-13 23:10:18,1,8,40,4.12,I access 20month GPT4 on my raspberry pi,Yes,4
post26con,controversial,deepest_subtree_-happycow-_level4,-happycow-,0,4,4,deepest_subtree_-happycow-_level4_comment_0026,Equal-Association818,2,2,2025-04-13 18:56:01,2,26,137,4.23,The difference in wealth comes from who gets to work in AI not who has access to AI. The difference ...,Yes,4
post26con,controversial,deepest_subtree_-happycow-_level4,-happycow-,0,4,4,deepest_subtree_-happycow-_level4_comment_0027,Efficient_Mud_5446,3,3,2025-04-13 21:41:17,3,38,192,3.97,More like Its those who own the means of production versus everyone else. A worker is just a worker ...,Yes,4
post26con,controversial,deepest_subtree_-happycow-_level4,-happycow-,0,4,4,deepest_subtree_-happycow-_level4_comment_0028,Nintendo_Pro_03,4,4,2025-04-13 21:49:42,1,6,39,5.5,George Carlin said something like that.,Yes,4
post26con,controversial,deepest_subtree_-happycow-_level4,-happycow-,0,4,4,deepest_subtree_-happycow-_level4_comment_0029,Nintendo_Pro_03,2,2,2025-04-13 22:12:19,1,14,83,4.79,"Yeah, but what would they do with that information, with AI taking over everything?",Yes,4
post26con,controversial,deepest_subtree_-happycow-_level4,-happycow-,0,4,4,deepest_subtree_-happycow-_level4_comment_0030,MacPR,2,2,2025-04-13 22:52:19,1,12,59,3.92,What good is this all this info if youre broke and jobless?,Yes,4
post26con,controversial,deepest_subtree_-happycow-_level4,-happycow-,0,4,4,deepest_subtree_-happycow-_level4_comment_0031,passthesentientlife,2,2,2025-04-13 18:59:54,1,24,137,4.71,Because inequality has very little to do with access to anything but money which is a quantification...,Yes,4
post26con,controversial,deepest_subtree_-happycow-_level4,-happycow-,0,4,4,deepest_subtree_-happycow-_level4_comment_0032,odious_as_fuck,3,3,2025-04-13 19:07:17,1,16,80,3.88,"Sorry for being naive, this thread is giving me a lot to think about. Thank you!",Yes,4
post26tec,technical,deepest_subtree_NoLifeGamer2_level4,NoLifeGamer2,0,4,4,deepest_subtree_NoLifeGamer2_level4_comment_0001,NoLifeGamer2,0,0,2023-02-06 11:50:10,3,12,55,3.67,I love how bloom was just like Fck it lets oneup openAI,Yes,4
post26tec,technical,deepest_subtree_NoLifeGamer2_level4,NoLifeGamer2,0,4,4,deepest_subtree_NoLifeGamer2_level4_comment_0002,sinavski,1,1,2023-02-06 12:10:05,2,18,88,3.83,"Yeah, I think its a just like a 1B MLP with random weights not connected to any outputs:",Yes,4
post26tec,technical,deepest_subtree_NoLifeGamer2_level4,NoLifeGamer2,0,4,4,deepest_subtree_NoLifeGamer2_level4_comment_0003,NoLifeGamer2,2,2,2023-02-06 12:13:54,1,5,33,5.8,Honestly wouldnt be surprised lol,Yes,4
post26tec,technical,deepest_subtree_NoLifeGamer2_level4,NoLifeGamer2,0,4,4,deepest_subtree_NoLifeGamer2_level4_comment_0004,visarga,2,2,2023-02-06 15:55:13,1,8,40,3.88,Does Bloom do tasks? is it well behaved?,Yes,4
post26tec,technical,deepest_subtree_NoLifeGamer2_level4,NoLifeGamer2,0,4,4,deepest_subtree_NoLifeGamer2_level4_comment_0005,farmingvillein,3,3,2023-02-07 00:00:22,3,5,39,6.8,"bloom is pretty terrible, unfortunately",Yes,4
post26tec,technical,deepest_subtree_NoLifeGamer2_level4,NoLifeGamer2,0,4,4,deepest_subtree_NoLifeGamer2_level4_comment_0006,Long_Two_6176,4,4,2023-07-17 19:36:59,1,6,25,3.17,What do you mean by that?,Yes,4
post27con,controversial,deepest_subtree_Downtown-Tomato2552_level4,Downtown-Tomato2552,0,4,4,deepest_subtree_Downtown-Tomato2552_level4_comment_0001,Downtown-Tomato2552,0,0,2025-01-26 11:45:25,40,148,789,4.28,So does anyone have sources from AI Experts that discuss this? Im not particularly young and thus ha...,Yes,4
post27con,controversial,deepest_subtree_Downtown-Tomato2552_level4,Downtown-Tomato2552,0,4,4,deepest_subtree_Downtown-Tomato2552_level4_comment_0002,DarkExecutor,1,1,2025-01-26 13:18:40,34,47,244,4.15,"This is exactly how AI will work as well. It will eliminate some jobs, but people will need actual w...",Yes,4
post27con,controversial,deepest_subtree_Downtown-Tomato2552_level4,Downtown-Tomato2552,0,4,4,deepest_subtree_Downtown-Tomato2552_level4_comment_0003,Downtown-Tomato2552,2,2,2025-01-26 14:12:53,18,64,329,4.06,Why cant AI input the data? The assumption here is that only humans will be able to discover new dat...,Yes,4
post27con,controversial,deepest_subtree_Downtown-Tomato2552_level4,Downtown-Tomato2552,0,4,4,deepest_subtree_Downtown-Tomato2552_level4_comment_0004,DarkExecutor,3,3,2025-01-26 14:36:51,14,19,93,3.89,Because how do you know if its right? Relying on AI to always tell you the truth is dangerous,Yes,4
post27con,controversial,deepest_subtree_Downtown-Tomato2552_level4,Downtown-Tomato2552,0,4,4,deepest_subtree_Downtown-Tomato2552_level4_comment_0005,ImpressiveFishing405,4,4,2025-01-26 14:39:43,17,9,48,4.44,You could definitely say the same for humans too,Yes,4
post27con,controversial,deepest_subtree_Downtown-Tomato2552_level4,Downtown-Tomato2552,0,4,4,deepest_subtree_Downtown-Tomato2552_level4_comment_0006,Downtown-Tomato2552,4,4,2025-01-26 14:56:37,3,105,585,4.48,One of the big concerns with AI right now is that the miss information available to the models is gr...,Yes,4
post27con,controversial,deepest_subtree_Downtown-Tomato2552_level4,Downtown-Tomato2552,0,4,4,deepest_subtree_Downtown-Tomato2552_level4_comment_0007,capndiln,4,4,2025-01-26 18:22:35,0,25,109,3.32,"As long as the cost of a wrong action by the agent is less than the cost of using a human, its not a...",Yes,4
post27con,controversial,deepest_subtree_Downtown-Tomato2552_level4,Downtown-Tomato2552,0,4,4,deepest_subtree_Downtown-Tomato2552_level4_comment_0008,Mondkohl,3,3,2025-01-27 00:09:16,3,43,245,4.63,Because the AI training the AI generates mostly nonsense. The skill with AI comes with knowing how t...,Yes,4
post27con,controversial,deepest_subtree_Downtown-Tomato2552_level4,Downtown-Tomato2552,0,4,4,deepest_subtree_Downtown-Tomato2552_level4_comment_0009,Otterswannahavefun,2,2,2025-01-26 19:37:52,2,17,93,4.47,Itd also going to generate jobs in things like green energy and chip manufacturing in the US.,Yes,4
post27con,controversial,deepest_subtree_Downtown-Tomato2552_level4,Downtown-Tomato2552,0,4,4,deepest_subtree_Downtown-Tomato2552_level4_comment_0010,5TP1090G_FC,2,2,2025-01-26 20:06:42,2,11,49,3.36,"I like that joke, Ive used it a few times before.",Yes,4
