parent_post_id,conversation_type,subtree_id,subtree_root_author,subtree_root_depth,subtree_max_depth,subtree_depth_span,comment_id,author,normalized_depth,original_depth,timestamp,score,word_count,character_count,avg_word_length,cleaned_text_sample,depth_cap_applied,max_depth_analyzed
post48con,controversial,deepest_subtree_carlos_6m_level4,carlos_6m,0,4,4,deepest_subtree_carlos_6m_level4_comment_0033,carlos_6m,2,2,2022-06-16 10:44:08,2,114,611,4.3,"i read a bit more and the explanation is more simple, it has to do with bias in diagnostics made by ...",Yes,4
post48con,controversial,deepest_subtree_carlos_6m_level4,carlos_6m,0,4,4,deepest_subtree_carlos_6m_level4_comment_0034,dot-c,3,3,2022-06-16 10:50:22,2,6,27,3.17,"Ohhh, now i get it, thanks!",Yes,4
post48tec,technical,deepest_subtree_NeedleworkerNo4900_level4,NeedleworkerNo4900,0,3,3,deepest_subtree_NeedleworkerNo4900_level4_comment_0001,NeedleworkerNo4900,0,0,2025-06-04 18:25:38,2,11,50,3.55,I dont see the word weasel in that example at all.,Yes,4
post48tec,technical,deepest_subtree_NeedleworkerNo4900_level4,NeedleworkerNo4900,0,3,3,deepest_subtree_NeedleworkerNo4900_level4_comment_0002,Puzzleheaded_Owl577,1,1,2025-06-04 18:40:30,2,44,264,4.89,Sorry for the confusion. I did not mean the word weasel itself. Weasel words refer to vague or nonco...,Yes,4
post48tec,technical,deepest_subtree_NeedleworkerNo4900_level4,NeedleworkerNo4900,0,3,3,deepest_subtree_NeedleworkerNo4900_level4_comment_0003,NeedleworkerNo4900,2,2,2025-06-04 18:43:01,1,26,148,4.65,The point I was trying to make is that maybe you just need clearer instructions? Are you providing o...,Yes,4
post48tec,technical,deepest_subtree_NeedleworkerNo4900_level4,NeedleworkerNo4900,0,3,3,deepest_subtree_NeedleworkerNo4900_level4_comment_0004,Puzzleheaded_Owl577,3,3,2025-06-04 18:49:02,1,64,386,4.92,"Thanks for the question. Yes, Ive actually provided multishot examples along with explicit regex pat...",Yes,4
post49con,controversial,deepest_subtree_Deleted_level4,Deleted,0,4,4,deepest_subtree_Deleted_level4_comment_0001,Deleted,0,0,2022-02-08 19:06:16,3,56,297,4.11,You have to understand that the prejudice is with you... The AI is just looking for patterns and rep...,Yes,4
post49con,controversial,deepest_subtree_Deleted_level4,Deleted,0,4,4,deepest_subtree_Deleted_level4_comment_0002,AConcernedCoder,1,1,2022-02-17 20:37:08,3,153,855,4.49,"Im going to go against the flow here and disagree, to an extent. If we say that the decisions made b...",Yes,4
post49con,controversial,deepest_subtree_Deleted_level4,Deleted,0,4,4,deepest_subtree_Deleted_level4_comment_0003,Deleted,2,2,2022-02-17 20:48:12,2,211,1168,4.44,"I mean, it wouldnt be targeting based on skin color, it would be targeting based on crime rate... Pe...",Yes,4
post49con,controversial,deepest_subtree_Deleted_level4,Deleted,0,4,4,deepest_subtree_Deleted_level4_comment_0004,AConcernedCoder,3,3,2022-02-17 21:58:30,1,274,1629,4.85,"Im not sure that something like a continuously learning model would be best for this, but just assum...",Yes,4
post49con,controversial,deepest_subtree_Deleted_level4,Deleted,0,4,4,deepest_subtree_Deleted_level4_comment_0005,Deleted,4,4,2022-02-17 22:31:58,2,103,591,4.53,That isnt how AI works... it is specifically AI because it isnt being told what to do... it is attem...,Yes,4
post49con,controversial,deepest_subtree_Deleted_level4,Deleted,0,4,4,deepest_subtree_Deleted_level4_comment_0006,Deleted,4,4,2022-02-17 22:36:33,0,46,275,4.76,"As for your ps... again, we are actively pursuing unbiased outcomes exactly because we already under...",Yes,4
post49con,controversial,deepest_subtree_Deleted_level4,Deleted,0,4,4,deepest_subtree_Deleted_level4_comment_0007,Deleted,4,4,2022-02-17 22:39:06,1,20,110,4.45,You are correct on one matter though: small data sets yeild unuseful results Do you think there is a...,Yes,4
post49tec,technical,deepest_subtree_EnricoShippole_level4,EnricoShippole,0,4,4,deepest_subtree_EnricoShippole_level4_comment_0001,EnricoShippole,0,0,2023-06-30 02:19:50,14,23,114,3.78,"We will be releasing a suite of finetunes on both Llama 7b, 13b and OpenLlama 3b, 7b, 13b, 20b in th...",Yes,4
post49tec,technical,deepest_subtree_EnricoShippole_level4,EnricoShippole,0,4,4,deepest_subtree_EnricoShippole_level4_comment_0002,kidovate,1,1,2023-06-30 14:49:48,3,13,71,4.46,Where can I subscribe to updates to be notified when you release these?,Yes,4
post49tec,technical,deepest_subtree_EnricoShippole_level4,EnricoShippole,0,4,4,deepest_subtree_EnricoShippole_level4_comment_0003,EnricoShippole,2,2,2023-07-01 17:23:09,1,19,124,5.47,They will be released under a unified organization on Huggingface after further evaluation. The firs...,Yes,4
post49tec,technical,deepest_subtree_EnricoShippole_level4,EnricoShippole,0,4,4,deepest_subtree_EnricoShippole_level4_comment_0004,AltNomad,3,3,2023-07-18 07:51:10,1,34,170,3.97,Ive been keeping an eye on this space. Any updates on the model releases? I think I found you and s ...,Yes,4
post49tec,technical,deepest_subtree_EnricoShippole_level4,EnricoShippole,0,4,4,deepest_subtree_EnricoShippole_level4_comment_0005,EnricoShippole,4,4,2023-07-19 18:57:53,3,7,37,4.29,All of the models are available here:,Yes,4
post4con,controversial,deepest_subtree_bezelboot69_level4,bezelboot69,0,4,4,deepest_subtree_bezelboot69_level4_comment_0001,bezelboot69,0,0,2024-08-28 15:38:36,208,32,173,4.38,As someone from the south who learned to drop the accent  I could be speaking on matters of thermody...,Yes,4
post4con,controversial,deepest_subtree_bezelboot69_level4,bezelboot69,0,4,4,deepest_subtree_bezelboot69_level4_comment_0002,Bayo09,1,1,2024-08-28 19:07:33,59,13,70,4.38,Subtract accent and go up and octave and doors literally open for you.,Yes,4
post4con,controversial,deepest_subtree_bezelboot69_level4,bezelboot69,0,4,4,deepest_subtree_bezelboot69_level4_comment_0003,bezelboot69,2,2,2024-08-29 08:02:22,4,9,57,5.22,You explained my career. Imposter syndrome is extra real.,Yes,4
post4con,controversial,deepest_subtree_bezelboot69_level4,bezelboot69,0,4,4,deepest_subtree_bezelboot69_level4_comment_0004,GardenPeep,1,1,2024-08-28 20:00:00,48,106,620,4.77,Every culture has its ways to signify normal acceptable trustworthy smart masculine feminine educate...,Yes,4
post4con,controversial,deepest_subtree_bezelboot69_level4,bezelboot69,0,4,4,deepest_subtree_bezelboot69_level4_comment_0005,aureve,2,2,2024-08-28 23:22:38,26,34,202,4.82,"But they are reflecting something. LLMs are trained on real data, essentially reflecting what it see...",Yes,4
post4con,controversial,deepest_subtree_bezelboot69_level4,bezelboot69,0,4,4,deepest_subtree_bezelboot69_level4_comment_0006,Open_Buy2303,3,3,2024-08-29 05:22:46,9,16,92,4.69,Key point. LLMs are sticking our own unconscious bias with language right back in our faces.,Yes,4
post4con,controversial,deepest_subtree_bezelboot69_level4,bezelboot69,0,4,4,deepest_subtree_bezelboot69_level4_comment_0007,aureve,4,4,2024-08-29 10:06:15,0,22,122,4.41,"So, LLMs are basically children that dont know any better. Coming soon to ABC this fall, its LLMs Sa...",Yes,4
post4con,controversial,deepest_subtree_bezelboot69_level4,bezelboot69,0,4,4,deepest_subtree_bezelboot69_level4_comment_0008,GardenPeep,3,3,2024-08-29 17:03:20,1,128,764,4.85,"That data is language, a.k.a. text. I believe a lot of it is translated into English and then maybe ...",Yes,4
post4con,controversial,deepest_subtree_bezelboot69_level4,bezelboot69,0,4,4,deepest_subtree_bezelboot69_level4_comment_0009,Disastrous_Lab_9171,3,3,2024-08-28 23:54:43,1,14,81,4.79,Im not being critical when I ask how dead Internet theory impacts your statement?,Yes,4
post4con,controversial,deepest_subtree_bezelboot69_level4,bezelboot69,0,4,4,deepest_subtree_bezelboot69_level4_comment_0010,aureve,4,4,2024-08-29 10:05:00,1,14,81,4.79,It doesnt; just adds another layer bots trained on bots trained on real responses,Yes,4
post4con,controversial,deepest_subtree_bezelboot69_level4,bezelboot69,0,4,4,deepest_subtree_bezelboot69_level4_comment_0011,Deleted,1,1,2024-08-29 01:26:13,8,39,193,3.9,Nailed it. At some point in the past 25ish years I think a lot of kids in the south were taught on s...,Yes,4
post4con,controversial,deepest_subtree_bezelboot69_level4,bezelboot69,0,4,4,deepest_subtree_bezelboot69_level4_comment_0012,Pseudoburbia,2,2,2024-08-29 09:30:12,4,43,247,4.67,Because everyone came to think of the south as synonymous with racism. The truth is racists are ever...,Yes,4
post4con,controversial,deepest_subtree_bezelboot69_level4,bezelboot69,0,4,4,deepest_subtree_bezelboot69_level4_comment_0013,G0_pack_go,1,1,2024-08-29 06:46:59,1,21,120,4.67,I remember the oak creek national lab having voluntary classes on losing the accent. It was very pol...,Yes,4
post4con,controversial,deepest_subtree_bezelboot69_level4,bezelboot69,0,4,4,deepest_subtree_bezelboot69_level4_comment_0014,jambeatsjelly,1,1,2024-08-29 11:10:35,1,187,999,4.22,"I left MS when I graduated college in 00. Early in my career, I saw someone make a face when someone...",Yes,4
post4con,controversial,deepest_subtree_bezelboot69_level4,bezelboot69,0,4,4,deepest_subtree_bezelboot69_level4_comment_0015,kenrnfjj,1,1,2024-08-28 22:32:59,-1,16,78,3.94,Its probably why so many of the tv show hosts in America have a british accent,Yes,4
post50con,controversial,deepest_subtree_BadgerNips_level4,BadgerNips,0,4,4,deepest_subtree_BadgerNips_level4_comment_0001,BadgerNips,0,0,2022-05-23 08:31:26,1773,19,89,3.58,"I dont mean to show off, but I can do this just by looking at someone, no xrays required.",Yes,4
post50con,controversial,deepest_subtree_BadgerNips_level4,BadgerNips,0,4,4,deepest_subtree_BadgerNips_level4_comment_0002,Romeo9594,1,1,2022-05-23 10:35:26,353,57,305,4.3,Thats a less common skill than youd think. The number of times my Hawaiian friend has been called Me...,Yes,4
post50con,controversial,deepest_subtree_BadgerNips_level4,BadgerNips,0,4,4,deepest_subtree_BadgerNips_level4_comment_0003,orbital,2,2,2022-05-23 10:55:47,101,34,185,4.41,"People always assume my buddys 100 Mexican dad is East Asian Indian, so much so when he goes into co...",Yes,4
post50con,controversial,deepest_subtree_BadgerNips_level4,BadgerNips,0,4,4,deepest_subtree_BadgerNips_level4_comment_0004,notyetcomitteds2,3,3,2022-05-23 17:12:59,20,46,277,4.76,"My bro has this in reverse. Everyone thinks hes Mexican. People lean more towards black for me, but ...",Yes,4
post50con,controversial,deepest_subtree_BadgerNips_level4,BadgerNips,0,4,4,deepest_subtree_BadgerNips_level4_comment_0005,AnthropomorphicPoop,4,4,2022-05-24 04:49:57,4,19,121,5.42,fretful groovy fade spectacular sparkle roll wrench truck seed full This post was mass deleted and a...,Yes,4
post50con,controversial,deepest_subtree_BadgerNips_level4,BadgerNips,0,4,4,deepest_subtree_BadgerNips_level4_comment_0006,CupBeEmpty,2,2,2022-05-23 12:56:58,17,32,188,4.81,My former boss is Moroccan. The number of Spanish speaking clients that lead with Spanish is pretty ...,Yes,4
post50con,controversial,deepest_subtree_BadgerNips_level4,BadgerNips,0,4,4,deepest_subtree_BadgerNips_level4_comment_0007,MarilynMonheaux,3,3,2022-05-24 03:37:31,2,20,113,4.55,"To be fair Moroccans living near Ceuta, Melilla, and In Tangier know Spanish as a second language an...",Yes,4
post50con,controversial,deepest_subtree_BadgerNips_level4,BadgerNips,0,4,4,deepest_subtree_BadgerNips_level4_comment_0008,CupBeEmpty,4,4,2022-05-24 07:29:23,1,11,62,4.64,I dont think thats why people started speaking Spanish to her.,Yes,4
post50con,controversial,deepest_subtree_BadgerNips_level4,BadgerNips,0,4,4,deepest_subtree_BadgerNips_level4_comment_0009,SpreadItLikeTheHerp,2,2,2022-05-23 12:20:32,46,27,144,4.26,"Am Hawaiian, can confirm. When I was driving out west and stopping in Dennys or other diners to eat ...",Yes,4
post50con,controversial,deepest_subtree_BadgerNips_level4,BadgerNips,0,4,4,deepest_subtree_BadgerNips_level4_comment_0010,namean_jellybean,3,3,2022-05-23 13:52:09,41,71,390,4.45,"Am mixed chinese and white  in the summer when I am tan, i always get stopped by little abuelas in t...",Yes,4
post50con,controversial,deepest_subtree_BadgerNips_level4,BadgerNips,0,4,4,deepest_subtree_BadgerNips_level4_comment_0011,KimJongFunk,4,4,2022-05-23 15:45:49,7,12,64,4.25,Same here! I speak some Spanish too which adds to the confusion.,Yes,4
post50con,controversial,deepest_subtree_BadgerNips_level4,BadgerNips,0,4,4,deepest_subtree_BadgerNips_level4_comment_0012,MyAltFun,4,4,2022-05-23 16:44:07,2,47,255,4.34,"Dude, HawaiianChineseWhite but can only really see the Hawaiian, I had to stop getting haircuts I li...",Yes,4
post50con,controversial,deepest_subtree_BadgerNips_level4,BadgerNips,0,4,4,deepest_subtree_BadgerNips_level4_comment_0013,Kazeshio,4,4,2022-05-23 17:27:40,2,6,23,3.0,This is so cute tho wtf,Yes,4
post50con,controversial,deepest_subtree_BadgerNips_level4,BadgerNips,0,4,4,deepest_subtree_BadgerNips_level4_comment_0014,21Rollie,4,4,2022-05-24 10:38:31,2,22,111,4.05,If I were you Id start brushing up on the duolingo. Get myself invited to a Hispanic barbecue at som...,Yes,4
post50con,controversial,deepest_subtree_BadgerNips_level4,BadgerNips,0,4,4,deepest_subtree_BadgerNips_level4_comment_0015,Rattus375,4,4,2022-05-23 22:53:09,1,85,429,4.01,"Im just straight up white, but am tan and have dark curly hair and used to get confused for Mexican ...",Yes,4
post50con,controversial,deepest_subtree_BadgerNips_level4,BadgerNips,0,4,4,deepest_subtree_BadgerNips_level4_comment_0016,C137-Morty,2,2,2022-05-23 13:46:08,2,41,232,4.61,Obviously the cultures are way different but that dna shares common roots. Based on the context from...,Yes,4
post50con,controversial,deepest_subtree_BadgerNips_level4,BadgerNips,0,4,4,deepest_subtree_BadgerNips_level4_comment_0017,Poesvliegtuig,2,2,2022-05-23 13:45:26,2,25,135,4.44,Had a Lebanese friend whose nickname in HS was The Mexican because after he grew a bit of a moustach...,Yes,4
post50con,controversial,deepest_subtree_BadgerNips_level4,BadgerNips,0,4,4,deepest_subtree_BadgerNips_level4_comment_0018,Deleted,2,2,2022-05-23 19:09:58,2,8,53,5.62,Maybe your friend should double check their skeleton.,Yes,4
post50con,controversial,deepest_subtree_BadgerNips_level4,BadgerNips,0,4,4,deepest_subtree_BadgerNips_level4_comment_0019,LIL_SHINY,2,2,2022-05-23 20:37:07,2,33,182,4.48,My Hawaiian friend would get very upset and violent to good friends when people would call him Mexic...,Yes,4
post50con,controversial,deepest_subtree_BadgerNips_level4,BadgerNips,0,4,4,deepest_subtree_BadgerNips_level4_comment_0020,Deleted,2,2,2022-05-24 15:21:04,0,52,344,5.46,"Those are localities statescountries, not races. Races are black, white, yellow and brown, and theyr...",Yes,4
post50con,controversial,deepest_subtree_BadgerNips_level4,BadgerNips,0,4,4,deepest_subtree_BadgerNips_level4_comment_0021,Republican_Wet_Dream,2,2,2022-05-23 14:39:44,1,12,53,3.42,Are you making up the part about the dog and the car?,Yes,4
post50con,controversial,deepest_subtree_BadgerNips_level4,BadgerNips,0,4,4,deepest_subtree_BadgerNips_level4_comment_0022,Romeo9594,3,3,2022-05-23 15:20:29,2,40,182,3.5,"I wish, ha. The car was his dads from way back when so that much I get. But of all the dogs he could...",Yes,4
post50con,controversial,deepest_subtree_BadgerNips_level4,BadgerNips,0,4,4,deepest_subtree_BadgerNips_level4_comment_0023,Republican_Wet_Dream,4,4,2022-05-23 16:34:33,1,6,30,4.0,Thats a great story. Thank you,Yes,4
post50con,controversial,deepest_subtree_BadgerNips_level4,BadgerNips,0,4,4,deepest_subtree_BadgerNips_level4_comment_0024,merrickx,2,2,2022-05-23 16:00:30,1,19,115,5.0,"Youre kind of reinforcing the idea though because while hes often misidentified, its almost always i...",Yes,4
post50con,controversial,deepest_subtree_BadgerNips_level4,BadgerNips,0,4,4,deepest_subtree_BadgerNips_level4_comment_0025,Spiralife,2,2,2022-05-23 16:02:16,1,43,252,4.84,Whenever this topic comes up Im reminded of a study done in east asian countries that found while mo...,Yes,4
post50con,controversial,deepest_subtree_BadgerNips_level4,BadgerNips,0,4,4,deepest_subtree_BadgerNips_level4_comment_0026,Feral0_o,2,2,2022-05-23 16:35:21,1,34,176,4.12,"As a standard issue white guy, the best I can offer is that several people in Istanbul confused me f...",Yes,4
post50con,controversial,deepest_subtree_BadgerNips_level4,BadgerNips,0,4,4,deepest_subtree_BadgerNips_level4_comment_0027,BidenWontMoveLeft,2,2,2022-05-23 16:44:15,1,7,31,3.57,I dont think Hawaiian is a race,Yes,4
post50con,controversial,deepest_subtree_BadgerNips_level4,BadgerNips,0,4,4,deepest_subtree_BadgerNips_level4_comment_0028,Romeo9594,3,3,2022-05-23 16:54:30,2,23,143,5.17,"Correct, his race is Pacific Islander. But Hawaiian is easier to type and conveys the message well e...",Yes,4
post50con,controversial,deepest_subtree_BadgerNips_level4,BadgerNips,0,4,4,deepest_subtree_BadgerNips_level4_comment_0029,Cyrus_Marius,2,2,2022-05-23 16:57:06,1,39,194,3.92,It is way more difficult than most imagine. In one of my anthropology labs we had an activity where ...,Yes,4
post50con,controversial,deepest_subtree_BadgerNips_level4,BadgerNips,0,4,4,deepest_subtree_BadgerNips_level4_comment_0030,MitziuE,2,2,2022-05-23 22:02:29,1,59,283,3.75,"I think you meant El Camino What you wrote says The cumin  Also, my dad did the same with this kid t...",Yes,4
post50con,controversial,deepest_subtree_BadgerNips_level4,BadgerNips,0,4,4,deepest_subtree_BadgerNips_level4_comment_0031,21Rollie,2,2,2022-05-24 10:28:16,1,31,150,3.84,"Im ambiguous so I can go to like half the world and blend in, until they start speaking to me in the...",Yes,4
post50con,controversial,deepest_subtree_BadgerNips_level4,BadgerNips,0,4,4,deepest_subtree_BadgerNips_level4_comment_0032,Equixels,1,1,2022-05-23 11:01:17,36,12,69,4.67,You racist then man. I only see genderless ageless raceless beings. s,Yes,4
post50con,controversial,deepest_subtree_BadgerNips_level4,BadgerNips,0,4,4,deepest_subtree_BadgerNips_level4_comment_0033,deelyy,2,2,2022-05-23 12:22:18,16,18,92,3.94,"Whoa there. So, you did not want to respect my identity by ignoring my gender, age and race?",Yes,4
post50con,controversial,deepest_subtree_BadgerNips_level4,BadgerNips,0,4,4,deepest_subtree_BadgerNips_level4_comment_0034,chattywww,2,2,2022-05-24 04:27:18,2,9,36,3.0,Im an AI and I take offense to that.,Yes,4
post50con,controversial,deepest_subtree_BadgerNips_level4,BadgerNips,0,4,4,deepest_subtree_BadgerNips_level4_comment_0035,merrickx,2,2,2022-05-23 16:01:19,4,9,47,4.0,"I see amorphous blobs. One race, the blob race.",Yes,4
post50con,controversial,deepest_subtree_BadgerNips_level4,BadgerNips,0,4,4,deepest_subtree_BadgerNips_level4_comment_0036,Crawfish_Fails,3,3,2022-05-23 16:55:32,4,11,56,4.0,"If everyone is just a blob you may need glasses, friend.",Yes,4
post50con,controversial,deepest_subtree_BadgerNips_level4,BadgerNips,0,4,4,deepest_subtree_BadgerNips_level4_comment_0037,Equixels,3,3,2022-05-23 16:01:54,1,3,19,5.67,The true antiracist,Yes,4
post50con,controversial,deepest_subtree_BadgerNips_level4,BadgerNips,0,4,4,deepest_subtree_BadgerNips_level4_comment_0038,quimera7557,3,3,2022-05-23 16:49:54,1,14,63,3.57,We are just blobs of LCL held together by AT fields I would say,Yes,4
post50con,controversial,deepest_subtree_BadgerNips_level4,BadgerNips,0,4,4,deepest_subtree_BadgerNips_level4_comment_0039,Rortugal_McDichael,3,3,2022-05-23 17:13:16,-1,6,39,5.5,Those are just people from Mississippi.,Yes,4
post50con,controversial,deepest_subtree_BadgerNips_level4,BadgerNips,0,4,4,deepest_subtree_BadgerNips_level4_comment_0040,TimeIsTimeNow,1,1,2022-05-23 16:16:18,3,24,108,3.42,"Im not trying to show off either, but if I know a persons race, Im able to see into their body like ...",Yes,4
post50con,controversial,deepest_subtree_BadgerNips_level4,BadgerNips,0,4,4,deepest_subtree_BadgerNips_level4_comment_0041,badgerhands,1,1,2022-05-24 07:00:06,2,27,150,4.52,Between us we could really get a Badgerparty happening EDIT: to clarify this comment has little or n...,Yes,4
post50con,controversial,deepest_subtree_BadgerNips_level4,BadgerNips,0,4,4,deepest_subtree_BadgerNips_level4_comment_0042,BadgerNips,2,2,2022-05-24 08:25:06,2,22,128,4.77,"Were the twofour most threatening parts of the BadgerMegaZord, so we ought to be able to get some am...",Yes,4
post50con,controversial,deepest_subtree_BadgerNips_level4,BadgerNips,0,4,4,deepest_subtree_BadgerNips_level4_comment_0043,SoggyWaffleBrunch,1,1,2022-05-23 16:34:15,3,26,149,4.73,"Until you remember that race is a social construct, and even Germans and Italians werent considered ...",Yes,4
post50con,controversial,deepest_subtree_BadgerNips_level4,BadgerNips,0,4,4,deepest_subtree_BadgerNips_level4_comment_0044,__Phasewave__,1,1,2022-05-23 20:43:09,0,25,153,4.84,"I can do this by looking at craniums. You can tell age, sex, ethnic origin, pathologies, infer diet ...",Yes,4
post50con,controversial,deepest_subtree_BadgerNips_level4,BadgerNips,0,4,4,deepest_subtree_BadgerNips_level4_comment_0045,ZualaPips,1,1,2022-05-23 12:21:15,-2,10,45,3.5,I can tell just by the voice and word choice.,Yes,4
post50tec,technical,deepest_subtree_seanthenry_level4,seanthenry,0,4,4,deepest_subtree_seanthenry_level4_comment_0001,seanthenry,0,0,2023-08-05 09:32:57,2,10,50,4.0,Have you tried playing with any of the 32K models?,Yes,4
post50tec,technical,deepest_subtree_seanthenry_level4,seanthenry,0,4,4,deepest_subtree_seanthenry_level4_comment_0002,mll59,1,1,2023-08-05 10:53:32,1,17,88,4.12,"No, I havent seen quantized ggml files for that model yet that I can use with koboldcpp.",Yes,4
post50tec,technical,deepest_subtree_seanthenry_level4,seanthenry,0,4,4,deepest_subtree_seanthenry_level4_comment_0003,seanthenry,2,2,2023-08-05 12:44:22,2,18,88,3.89,Here you go one is the version mentioned and there is an orca version also both in ggml.,Yes,4
post50tec,technical,deepest_subtree_seanthenry_level4,seanthenry,0,4,4,deepest_subtree_seanthenry_level4_comment_0004,mll59,3,3,2023-08-05 15:23:31,3,48,267,4.52,Thank you. I have tried both models several times and I dont see any obvious problems with numbers i...,Yes,4
post50tec,technical,deepest_subtree_seanthenry_level4,seanthenry,0,4,4,deepest_subtree_seanthenry_level4_comment_0005,Sabin_Stargem,4,4,2023-08-05 15:40:56,6,47,224,3.68,I definitely would like someone to explain the formula for NTK scaling. I cant wrap my head around w...,Yes,4
post51con,controversial,deepest_subtree_Fippy-Darkpaw_level4,Fippy-Darkpaw,0,4,4,deepest_subtree_Fippy-Darkpaw_level4_comment_0001,Fippy-Darkpaw,0,0,2022-05-25 13:13:40,51,16,106,5.5,Breaking  computers can be more observant than humans. Seems like great news for archeology and fore...,Yes,4
post51con,controversial,deepest_subtree_Fippy-Darkpaw_level4,Fippy-Darkpaw,0,4,4,deepest_subtree_Fippy-Darkpaw_level4_comment_0002,Kr155,1,1,2022-05-26 13:03:39,6,20,107,4.25,"The question is, what is it observing that leads to its conclusions? Thats what the study aims to fi...",Yes,4
post51con,controversial,deepest_subtree_Fippy-Darkpaw_level4,Fippy-Darkpaw,0,4,4,deepest_subtree_Fippy-Darkpaw_level4_comment_0003,WhoresAndHorses,2,2,2022-05-26 13:17:20,3,7,45,5.29,"Chest xray imagery, according to the article.",Yes,4
post51con,controversial,deepest_subtree_Fippy-Darkpaw_level4,Fippy-Darkpaw,0,4,4,deepest_subtree_Fippy-Darkpaw_level4_comment_0004,Kr155,3,3,2022-05-26 13:22:51,5,53,296,4.55,Specifically what its observing about the chest xray imagery that allows it to determine the race of...,Yes,4
post51con,controversial,deepest_subtree_Fippy-Darkpaw_level4,Fippy-Darkpaw,0,4,4,deepest_subtree_Fippy-Darkpaw_level4_comment_0005,WhoresAndHorses,4,4,2022-05-26 13:27:45,-4,22,124,4.55,"Sure, I agree that is worth knowing. But the fact that we dont know yet doesnt justify shutting down...",Yes,4
post51con,controversial,deepest_subtree_Fippy-Darkpaw_level4,Fippy-Darkpaw,0,4,4,deepest_subtree_Fippy-Darkpaw_level4_comment_0006,kiwiwikikiwiwikikiwi,1,1,2022-05-25 14:56:25,-11,25,148,4.8,Yup. This was my response. I have the feeling the reactionary interpretation on here will be: Oh no!...,Yes,4
post51con,controversial,deepest_subtree_Fippy-Darkpaw_level4,Fippy-Darkpaw,0,4,4,deepest_subtree_Fippy-Darkpaw_level4_comment_0007,xmorecowbellx,2,2,2022-05-26 09:08:19,5,14,99,5.93,"You mean people worried that computers, being pure objectivity machines, are not sufficiently woke?",Yes,4
post51con,controversial,deepest_subtree_Fippy-Darkpaw_level4,Fippy-Darkpaw,0,4,4,deepest_subtree_Fippy-Darkpaw_level4_comment_0008,Seasfuckdoll,2,2,2022-05-26 03:20:02,4,26,132,4.0,"I think no one who reads the article fully will say that. That being said, most of those people dont...",Yes,4
post52con,controversial,deepest_subtree_StandardN02b_level4,StandardN02b,0,4,4,deepest_subtree_StandardN02b_level4_comment_0001,StandardN02b,0,0,2023-11-05 08:57:04,1516,13,93,6.15,As if anthropologists havent been using skeletons to determine etimology for decades already.,Yes,4
post52con,controversial,deepest_subtree_StandardN02b_level4,StandardN02b,0,4,4,deepest_subtree_StandardN02b_level4_comment_0002,FOFBattleCat,1,1,2023-11-05 10:13:57,589,11,55,4.0,What do skeletons have to do with the origins of words?,Yes,4
post52con,controversial,deepest_subtree_StandardN02b_level4,StandardN02b,0,4,4,deepest_subtree_StandardN02b_level4_comment_0003,StandardN02b,2,2,2023-11-05 11:03:03,631,11,57,4.0,"Fuck, I meant ethnicity. Sorry I am not a native speaker.",Yes,4
post52con,controversial,deepest_subtree_StandardN02b_level4,StandardN02b,0,4,4,deepest_subtree_StandardN02b_level4_comment_0004,PascalTheWise,3,3,2023-11-05 11:35:03,288,3,13,3.67,We dont mined,Yes,4
