parent_post_id,conversation_type,subtree_id,subtree_root_author,subtree_root_depth,subtree_max_depth,subtree_depth_span,comment_id,author,normalized_depth,original_depth,timestamp,score,word_count,character_count,avg_word_length,cleaned_text_sample,depth_cap_applied,max_depth_analyzed
post31con,controversial,deepest_subtree_Aggressive_Staff_982_level4,Aggressive_Staff_982,0,4,4,deepest_subtree_Aggressive_Staff_982_level4_comment_0022,Bloodcloud079,2,2,2025-02-06 13:13:55,30,30,155,4.07,"Just a heads up, price per share is a very poor indicator of a company value. Because number of shar...",Yes,4
post31con,controversial,deepest_subtree_Aggressive_Staff_982_level4,Aggressive_Staff_982,0,4,4,deepest_subtree_Aggressive_Staff_982_level4_comment_0023,Hoopy223,3,3,2025-02-06 13:46:36,5,18,97,4.28,"I know that but just look at market cap for example, google is like 2trillion, its mind boggling.",Yes,4
post31con,controversial,deepest_subtree_Aggressive_Staff_982_level4,Aggressive_Staff_982,0,4,4,deepest_subtree_Aggressive_Staff_982_level4_comment_0024,LUHG_HANI,4,4,2025-02-06 15:00:17,5,14,82,4.71,"Ford have to compete. Microsoft, Google and Meta wiped the web to suit themselves.",Yes,4
post31con,controversial,deepest_subtree_Aggressive_Staff_982_level4,Aggressive_Staff_982,0,4,4,deepest_subtree_Aggressive_Staff_982_level4_comment_0025,Bloodcloud079,4,4,2025-02-06 21:17:39,1,13,70,4.23,"I mean, yeah in this case it still works. Still, poor comparison basis",Yes,4
post31con,controversial,deepest_subtree_Aggressive_Staff_982_level4,Aggressive_Staff_982,0,4,4,deepest_subtree_Aggressive_Staff_982_level4_comment_0026,PuzzleheadedSlide904,2,2,2025-02-06 12:34:15,5,7,43,5.29,Working class people dont care about shares,Yes,4
post31con,controversial,deepest_subtree_Aggressive_Staff_982_level4,Aggressive_Staff_982,0,4,4,deepest_subtree_Aggressive_Staff_982_level4_comment_0027,Analyzer9,3,3,2025-02-06 12:42:15,7,82,415,3.91,"Its like there are two kinds of people. One kind hears a song, and says, That was lovely, or I did n...",Yes,4
post31con,controversial,deepest_subtree_Aggressive_Staff_982_level4,Aggressive_Staff_982,0,4,4,deepest_subtree_Aggressive_Staff_982_level4_comment_0028,Nice_Category,3,3,2025-02-06 12:56:43,-8,9,54,5.0,Thats why they remain working class their whole lives.,Yes,4
post31con,controversial,deepest_subtree_Aggressive_Staff_982_level4,Aggressive_Staff_982,0,4,4,deepest_subtree_Aggressive_Staff_982_level4_comment_0029,CoastPuzzleheaded513,1,1,2025-02-06 14:44:19,1,77,433,4.48,Vote with your service choices. They are only as useful and powerfull as you make them. Stop using t...,Yes,4
post31tec,technical,deepest_subtree_calebkaiser_level4,calebkaiser,0,4,4,deepest_subtree_calebkaiser_level4_comment_0001,calebkaiser,0,0,2025-01-28 11:24:17,3,308,1877,4.97,"According to the paper, they are not using a neural network to calculate the reward. It looks like t...",Yes,4
post31tec,technical,deepest_subtree_calebkaiser_level4,calebkaiser,0,4,4,deepest_subtree_calebkaiser_level4_comment_0002,Prestigiouspite,1,1,2025-01-28 16:45:18,1,41,229,4.51,The fact that you can train such a versatile and powerful model purely with reward functions seems a...,Yes,4
post31tec,technical,deepest_subtree_calebkaiser_level4,calebkaiser,0,4,4,deepest_subtree_calebkaiser_level4_comment_0003,me_but_darker,1,1,2025-01-30 21:14:00,1,63,366,4.7,"Hey, thanks for the reply. Previous LLM used SFT for instruction tuning i.e. ensuring that given a p...",Yes,4
post31tec,technical,deepest_subtree_calebkaiser_level4,calebkaiser,0,4,4,deepest_subtree_calebkaiser_level4_comment_0004,calebkaiser,2,2,2025-01-31 15:08:54,1,109,664,4.95,"Good question! From my understanding, there are two parts to this:  The format rewards encourage the...",Yes,4
post31tec,technical,deepest_subtree_calebkaiser_level4,calebkaiser,0,4,4,deepest_subtree_calebkaiser_level4_comment_0005,me_but_darker,3,3,2025-01-31 15:18:17,1,6,30,4.0,Thanks. Ill read the blog post,Yes,4
post31tec,technical,deepest_subtree_calebkaiser_level4,calebkaiser,0,4,4,deepest_subtree_calebkaiser_level4_comment_0006,Physical-Artist-6997,3,3,2025-02-01 08:38:36,1,62,344,4.45,"What I dont finally understand is the following: ok, every time the actioner produce and action outp...",Yes,4
post31tec,technical,deepest_subtree_calebkaiser_level4,calebkaiser,0,4,4,deepest_subtree_calebkaiser_level4_comment_0007,calebkaiser,4,4,2025-02-01 14:38:04,1,85,505,4.85,The policy in this case would just be the base model DeepSeekV3Base. I think the nomenclature from r...,Yes,4
post32con,controversial,deepest_subtree_Flat_Shame_2377_level4,Flat_Shame_2377,0,4,4,deepest_subtree_Flat_Shame_2377_level4_comment_0001,Flat_Shame_2377,0,0,2023-12-27 14:29:57,82,61,367,4.93,Why are people surprised by biometrics and by using social media to find grounds of inadmissibility?...,Yes,4
post32con,controversial,deepest_subtree_Flat_Shame_2377_level4,Flat_Shame_2377,0,4,4,deepest_subtree_Flat_Shame_2377_level4_comment_0002,XxX_Dick_Slayer_XxX,1,1,2023-12-27 15:11:44,38,19,138,6.32,observation dinner crush hungry alleged reminiscent march secretive roll quarrelsome This post was m...,Yes,4
post32con,controversial,deepest_subtree_Flat_Shame_2377_level4,Flat_Shame_2377,0,4,4,deepest_subtree_Flat_Shame_2377_level4_comment_0003,pensezbien,2,2,2023-12-27 15:19:25,15,42,213,4.0,"If you and your GF are US citizens, my understanding is that the US border face scanning is still of...",Yes,4
post32con,controversial,deepest_subtree_Flat_Shame_2377_level4,Flat_Shame_2377,0,4,4,deepest_subtree_Flat_Shame_2377_level4_comment_0004,Deleted,3,3,2023-12-27 16:38:19,14,24,117,3.88,"I tried opting out and the officer didnt know it was even possible, despite the sign in front of him...",Yes,4
post32con,controversial,deepest_subtree_Flat_Shame_2377_level4,Flat_Shame_2377,0,4,4,deepest_subtree_Flat_Shame_2377_level4_comment_0005,pensezbien,4,4,2023-12-27 17:01:03,3,23,102,3.35,Hah. Did you succeed in the end? And was this CBP on the way in or an airline official on the way ou...,Yes,4
post32con,controversial,deepest_subtree_Flat_Shame_2377_level4,Flat_Shame_2377,0,4,4,deepest_subtree_Flat_Shame_2377_level4_comment_0006,timoddo_,3,3,2023-12-27 16:49:23,10,32,177,4.5,"Genuine question, what do you gain by opting out at the border? They already have at least one pictu...",Yes,4
post32con,controversial,deepest_subtree_Flat_Shame_2377_level4,Flat_Shame_2377,0,4,4,deepest_subtree_Flat_Shame_2377_level4_comment_0007,pensezbien,4,4,2023-12-27 16:58:37,7,138,748,4.33,"Im not sure  Ive never opted out of that. In fact I participate in Global Entry through NEXUS, which...",Yes,4
post32con,controversial,deepest_subtree_Flat_Shame_2377_level4,Flat_Shame_2377,0,4,4,deepest_subtree_Flat_Shame_2377_level4_comment_0008,bubbabubba345,4,4,2023-12-27 18:53:56,1,67,379,4.6,To me its more on the principle of government using and developing expansive facial recognition data...,Yes,4
post32con,controversial,deepest_subtree_Flat_Shame_2377_level4,Flat_Shame_2377,0,4,4,deepest_subtree_Flat_Shame_2377_level4_comment_0009,Deleted,3,3,2023-12-28 22:25:06,1,11,65,4.91,Optional they probably scan you when you walk around the airport.,Yes,4
post32con,controversial,deepest_subtree_Flat_Shame_2377_level4,Flat_Shame_2377,0,4,4,deepest_subtree_Flat_Shame_2377_level4_comment_0010,pensezbien,1,1,2023-12-27 15:15:06,14,857,5086,4.84,The biggest problem with this as applied to prostitution specifically is that the CBP officers rarel...,Yes,4
post32con,controversial,deepest_subtree_Flat_Shame_2377_level4,Flat_Shame_2377,0,4,4,deepest_subtree_Flat_Shame_2377_level4_comment_0011,bubbabubba345,2,2,2023-12-27 18:57:36,8,73,462,5.26,This is a great response and I think the answer to your last question is unequivocal that the govern...,Yes,4
post32con,controversial,deepest_subtree_Flat_Shame_2377_level4,Flat_Shame_2377,0,4,4,deepest_subtree_Flat_Shame_2377_level4_comment_0012,Flat_Shame_2377,2,2,2023-12-27 18:55:24,1,38,228,4.89,Thats not accurate. Courts have checked immigration when theyve gone too far. You do understand this...,Yes,4
post32con,controversial,deepest_subtree_Flat_Shame_2377_level4,Flat_Shame_2377,0,4,4,deepest_subtree_Flat_Shame_2377_level4_comment_0013,pensezbien,3,3,2023-12-27 19:51:02,4,169,1083,5.3,"Courts have often refused to check immigration. Most importantly, there are extreme limits to when c...",Yes,4
post32con,controversial,deepest_subtree_Flat_Shame_2377_level4,Flat_Shame_2377,0,4,4,deepest_subtree_Flat_Shame_2377_level4_comment_0014,Flat_Shame_2377,4,4,2023-12-28 10:03:46,2,14,72,4.07,Looks like I was wrong. They dont use this to identify people in crowds.,Yes,4
post32con,controversial,deepest_subtree_Flat_Shame_2377_level4,Flat_Shame_2377,0,4,4,deepest_subtree_Flat_Shame_2377_level4_comment_0015,Deleted,2,2,2024-01-22 18:43:38,1,65,403,5.08,Maybe its because for marriage based visas consummation of marriage is required factor to permanent ...,Yes,4
post32con,controversial,deepest_subtree_Flat_Shame_2377_level4,Flat_Shame_2377,0,4,4,deepest_subtree_Flat_Shame_2377_level4_comment_0016,pensezbien,3,3,2024-01-23 05:38:08,2,707,4359,5.09,We dont have to speculate at the reason  its simply because INA 212a2Di specifically creates a statu...,Yes,4
post32con,controversial,deepest_subtree_Flat_Shame_2377_level4,Flat_Shame_2377,0,4,4,deepest_subtree_Flat_Shame_2377_level4_comment_0017,Deleted,1,1,2023-12-28 13:17:15,2,1,7,7.0,deleted,Yes,4
post32con,controversial,deepest_subtree_Flat_Shame_2377_level4,Flat_Shame_2377,0,4,4,deepest_subtree_Flat_Shame_2377_level4_comment_0018,ratonbox,2,2,2023-12-29 02:53:27,1,21,114,4.33,Nobody says its not wrong sometimes. Its just less wrong than a human being. All its doing is reduci...,Yes,4
post32con,controversial,deepest_subtree_Flat_Shame_2377_level4,Flat_Shame_2377,0,4,4,deepest_subtree_Flat_Shame_2377_level4_comment_0019,calcetines100,1,1,2023-12-29 01:16:26,1,30,191,5.3,Face recognition has been more and more mainstream in other developed countries. Some Americans thin...,Yes,4
post32con,controversial,deepest_subtree_Flat_Shame_2377_level4,Flat_Shame_2377,0,4,4,deepest_subtree_Flat_Shame_2377_level4_comment_0020,Bman847,2,2,2024-01-02 18:40:55,1,15,89,4.87,What obliviousness This could be used against the people. How do you not understand that?,Yes,4
post32con,controversial,deepest_subtree_Flat_Shame_2377_level4,Flat_Shame_2377,0,4,4,deepest_subtree_Flat_Shame_2377_level4_comment_0021,calcetines100,3,3,2024-01-02 18:50:11,1,46,255,4.48,"Yeah, I m so scared of government having an information on my face which they already have in four d...",Yes,4
post32con,controversial,deepest_subtree_Flat_Shame_2377_level4,Flat_Shame_2377,0,4,4,deepest_subtree_Flat_Shame_2377_level4_comment_0022,Bman847,4,4,2024-01-02 18:57:36,1,31,144,3.55,So they have all our info and can now use it to deny us certain things... Im sure this wont get wors...,Yes,4
post32con,controversial,deepest_subtree_Flat_Shame_2377_level4,Flat_Shame_2377,0,4,4,deepest_subtree_Flat_Shame_2377_level4_comment_0023,Deleted,1,1,2024-01-14 01:42:06,1,13,57,3.38,Where do they get the data of people faces ID to do this?,Yes,4
post32tec,technical,deepest_subtree_spezjetemerde_level4,spezjetemerde,0,4,4,deepest_subtree_spezjetemerde_level4_comment_0001,spezjetemerde,0,0,2024-04-03 16:15:53,118,10,41,3.1,do you have a kenyan army paid 2 an hour?,Yes,4
post32tec,technical,deepest_subtree_spezjetemerde_level4,spezjetemerde,0,4,4,deepest_subtree_spezjetemerde_level4_comment_0002,WhichOfTheWould,1,1,2024-04-03 16:30:55,12,29,151,4.17,What kindve dataset does it take to train the reward model? Im really a bit unsure on how much datac...,Yes,4
post32tec,technical,deepest_subtree_spezjetemerde_level4,spezjetemerde,0,4,4,deepest_subtree_spezjetemerde_level4_comment_0003,spezjetemerde,2,2,2024-04-03 16:34:52,17,25,158,5.24,"For simple tasks, you might get by with a few thousand samples; complex tasks may require millions. ...",Yes,4
post32tec,technical,deepest_subtree_spezjetemerde_level4,spezjetemerde,0,4,4,deepest_subtree_spezjetemerde_level4_comment_0004,qu3tzalify,3,3,2024-04-03 19:50:57,3,21,110,4.19,Ive always seen datasets for alignment being in the 100ks not much more. Do you know a paper using 1...,Yes,4
post32tec,technical,deepest_subtree_spezjetemerde_level4,spezjetemerde,0,4,4,deepest_subtree_spezjetemerde_level4_comment_0005,Impossible-Manager-7,4,4,2024-04-07 19:01:32,1,15,79,4.2,"Hi, could you share where you found info on datasets in the 100k for alignment?",Yes,4
post32tec,technical,deepest_subtree_spezjetemerde_level4,spezjetemerde,0,4,4,deepest_subtree_spezjetemerde_level4_comment_0006,pm_me_your_pay_slips,1,1,2024-04-04 09:52:01,1,19,111,4.79,For a really good dataset you need Americans making a bit more than that. Evaluating text quality is...,Yes,4
post32tec,technical,deepest_subtree_spezjetemerde_level4,spezjetemerde,0,4,4,deepest_subtree_spezjetemerde_level4_comment_0007,spezjetemerde,2,2,2024-04-04 10:01:00,2,7,35,4.14,i was referring to what openai used,Yes,4
post32tec,technical,deepest_subtree_spezjetemerde_level4,spezjetemerde,0,4,4,deepest_subtree_spezjetemerde_level4_comment_0008,Calm_Ad_5133,2,2,2024-04-07 18:53:51,1,9,51,4.78,Americans are possibly the worst cost to perf ratio,Yes,4
post33con,controversial,deepest_subtree_not_a_moogle_level4,not_a_moogle,0,4,4,deepest_subtree_not_a_moogle_level4_comment_0001,not_a_moogle,0,0,2024-03-16 17:03:17,505,11,75,5.55,"War, famine, dictators. Immigration is not typically looking for just work.",Yes,4
post33con,controversial,deepest_subtree_not_a_moogle_level4,not_a_moogle,0,4,4,deepest_subtree_not_a_moogle_level4_comment_0002,Deleted,1,1,2024-03-16 17:43:55,142,26,159,5.12,Dont forget environmental. Ive read that much of the Germanic tribes moving south towards Rome did s...,Yes,4
post33con,controversial,deepest_subtree_not_a_moogle_level4,not_a_moogle,0,4,4,deepest_subtree_not_a_moogle_level4_comment_0003,WobbleKing,2,2,2024-03-16 20:18:02,28,6,26,3.5,This time it will be north,Yes,4
post33con,controversial,deepest_subtree_not_a_moogle_level4,not_a_moogle,0,4,4,deepest_subtree_not_a_moogle_level4_comment_0004,Deleted,3,3,2024-03-16 21:07:21,18,4,25,5.5,It already is essentially,Yes,4
post33con,controversial,deepest_subtree_not_a_moogle_level4,not_a_moogle,0,4,4,deepest_subtree_not_a_moogle_level4_comment_0005,FrogsArchers,4,4,2024-03-18 15:20:54,3,10,57,4.5,Canadian here.. Can confirm. The GTA looks like New Delhi,Yes,4
post33con,controversial,deepest_subtree_not_a_moogle_level4,not_a_moogle,0,4,4,deepest_subtree_not_a_moogle_level4_comment_0006,Bigjoemonger,3,3,2024-03-17 11:09:43,0,124,651,4.17,No this time it will be away from sea level. About a third of the worlds population lives at sea lev...,Yes,4
post33con,controversial,deepest_subtree_not_a_moogle_level4,not_a_moogle,0,4,4,deepest_subtree_not_a_moogle_level4_comment_0007,Shieldheart-,2,2,2024-03-17 16:51:34,1,36,198,4.39,"Youre correct, there was a mini ice age at that time that caused mass harvest failure, giving the tr...",Yes,4
post33con,controversial,deepest_subtree_not_a_moogle_level4,not_a_moogle,0,4,4,deepest_subtree_not_a_moogle_level4_comment_0008,dobrits,2,2,2024-03-17 19:16:49,1,17,97,4.71,Who also probably had to migrate due to climate change. The winters in the steppe were unbearable,Yes,4
post33con,controversial,deepest_subtree_not_a_moogle_level4,not_a_moogle,0,4,4,deepest_subtree_not_a_moogle_level4_comment_0009,NecessaryCelery2,2,2,2024-03-18 01:09:21,1,13,73,4.62,And the Huns might have migrated west because of drought in Central Asia.,Yes,4
post33con,controversial,deepest_subtree_not_a_moogle_level4,not_a_moogle,0,4,4,deepest_subtree_not_a_moogle_level4_comment_0010,Anen-o-me,1,1,2024-03-16 23:53:03,6,3,18,5.0,Better law choice.,Yes,4
post33con,controversial,deepest_subtree_not_a_moogle_level4,not_a_moogle,0,4,4,deepest_subtree_not_a_moogle_level4_comment_0011,Stimbes,1,1,2024-03-16 18:25:44,26,7,34,4.0,Crime and to move to better weathe,Yes,4
post33con,controversial,deepest_subtree_not_a_moogle_level4,not_a_moogle,0,4,4,deepest_subtree_not_a_moogle_level4_comment_0012,outwest88,2,2,2024-03-17 00:25:31,10,17,108,5.18,Yeah seriously. This is the only reason Im considering emigrating. Crime and weather. Also culture a...,Yes,4
post33con,controversial,deepest_subtree_not_a_moogle_level4,not_a_moogle,0,4,4,deepest_subtree_not_a_moogle_level4_comment_0013,anonareyouokay,1,1,2024-03-16 18:12:57,36,2,14,6.5,Climate change,Yes,4
post33con,controversial,deepest_subtree_not_a_moogle_level4,not_a_moogle,0,4,4,deepest_subtree_not_a_moogle_level4_comment_0014,Thecrazier,1,1,2024-03-17 04:56:10,5,38,217,4.71,Yea on the immigrants side thats irrelevant because their country might not be advance enough so the...,Yes,4
post33con,controversial,deepest_subtree_not_a_moogle_level4,not_a_moogle,0,4,4,deepest_subtree_not_a_moogle_level4_comment_0015,Awkward_moments,1,1,2024-03-17 16:53:43,1,80,426,4.28,"It more to keep house prices high, GDP going up not GDP per capita and to keep wages low. If the gov...",Yes,4
post33con,controversial,deepest_subtree_not_a_moogle_level4,not_a_moogle,0,4,4,deepest_subtree_not_a_moogle_level4_comment_0016,Deleted,1,1,2024-03-17 01:09:35,2,14,72,4.14,No chance a struggling society is going to let a bunch of immigrants in.,Yes,4
post33con,controversial,deepest_subtree_not_a_moogle_level4,not_a_moogle,0,4,4,deepest_subtree_not_a_moogle_level4_comment_0017,Mediocre-Ebb9862,1,1,2024-03-16 19:07:20,0,27,157,4.67,"Plenty of people looking for better economic opportunities too. This is also what H1b, EB13 visas, O...",Yes,4
post33con,controversial,deepest_subtree_not_a_moogle_level4,not_a_moogle,0,4,4,deepest_subtree_not_a_moogle_level4_comment_0018,not_a_moogle,2,2,2024-03-16 19:10:44,9,27,146,4.3,The point is OP seems dumb posting why would immigrants come here if all the jobs are automated. As ...,Yes,4
post33con,controversial,deepest_subtree_not_a_moogle_level4,not_a_moogle,0,4,4,deepest_subtree_not_a_moogle_level4_comment_0019,castlebravo15megaton,3,3,2024-03-16 19:30:14,14,19,106,4.58,No he is asking why would a country want immigrants if they arent needed because those jobs are auto...,Yes,4
post33con,controversial,deepest_subtree_not_a_moogle_level4,not_a_moogle,0,4,4,deepest_subtree_not_a_moogle_level4_comment_0020,not_a_moogle,4,4,2024-03-16 19:46:21,0,17,105,5.06,"Well if jobs are automated, whats the point of countries. Might as well establish a planetary govern...",Yes,4
post33con,controversial,deepest_subtree_not_a_moogle_level4,not_a_moogle,0,4,4,deepest_subtree_not_a_moogle_level4_comment_0021,Deleted,1,1,2024-03-17 02:16:12,1,11,69,5.27,OP is asking whats the point of accepting immigrants not immigrating.,Yes,4
post33con,controversial,deepest_subtree_not_a_moogle_level4,not_a_moogle,0,4,4,deepest_subtree_not_a_moogle_level4_comment_0022,Odd_Photograph_7591,1,1,2024-03-16 19:20:49,-2,77,470,4.96,"I think migration will be in reverse, the countries that have the best weather will be the ones more...",Yes,4
post33con,controversial,deepest_subtree_not_a_moogle_level4,not_a_moogle,0,4,4,deepest_subtree_not_a_moogle_level4_comment_0023,alohadave,2,2,2024-03-16 20:10:47,8,21,120,4.62,"With global warming, people are going to move out of the tropics and subtropics. North to Canada and...",Yes,4
post33con,controversial,deepest_subtree_not_a_moogle_level4,not_a_moogle,0,4,4,deepest_subtree_not_a_moogle_level4_comment_0024,DirtyDan419,2,2,2024-03-16 21:33:40,3,14,81,4.79,Wouldnt global warming and rising sea levels fuck a lot of these destinations up?,Yes,4
post33con,controversial,deepest_subtree_not_a_moogle_level4,not_a_moogle,0,4,4,deepest_subtree_not_a_moogle_level4_comment_0025,markth_wi,3,3,2024-03-16 22:23:38,1,188,1189,5.21,"Some parts of the world are more fucked than others, Amsterdam , the low countries, the Adriatic coa...",Yes,4
post33con,controversial,deepest_subtree_not_a_moogle_level4,not_a_moogle,0,4,4,deepest_subtree_not_a_moogle_level4_comment_0026,MrBeforeMyTime,1,1,2024-03-16 18:16:43,-5,9,56,5.22,Better mate selection is also a reason people immigrate.,Yes,4
post33con,controversial,deepest_subtree_not_a_moogle_level4,not_a_moogle,0,4,4,deepest_subtree_not_a_moogle_level4_comment_0027,yepsayorte,1,1,2024-03-17 04:11:09,0,36,184,4.0,"No, most people come for the workmoney. Its always been for work. Elites use asylum as a way of wash...",Yes,4
post33con,controversial,deepest_subtree_not_a_moogle_level4,not_a_moogle,0,4,4,deepest_subtree_not_a_moogle_level4_comment_0028,Diatomack,1,1,2024-03-16 17:09:05,-12,19,110,4.74,Only a fraction of the population ever leave. It hardly makes a dent. The majority are stuck there f...,Yes,4
post33con,controversial,deepest_subtree_not_a_moogle_level4,not_a_moogle,0,4,4,deepest_subtree_not_a_moogle_level4_comment_0029,oneeyedziggy,2,2,2024-03-16 17:15:44,11,21,116,4.38,"Right, but that doesnt seem to have much to do with whether jobs get automated... Thats been true fo...",Yes,4
post33con,controversial,deepest_subtree_not_a_moogle_level4,not_a_moogle,0,4,4,deepest_subtree_not_a_moogle_level4_comment_0030,NorskKiwi,3,3,2024-03-16 17:52:04,2,14,91,5.43,Immigrants often work low paying jobs that automation might replace was maybe their point?.,Yes,4
post33con,controversial,deepest_subtree_not_a_moogle_level4,not_a_moogle,0,4,4,deepest_subtree_not_a_moogle_level4_comment_0031,Mediocre-Ebb9862,4,4,2024-03-16 19:09:46,1,8,48,5.0,Immigrants also often work high paying jobs too.,Yes,4
post33tec,technical,deepest_subtree_kawin_e_level4,kawin_e,0,4,4,deepest_subtree_kawin_e_level4_comment_0001,kawin_e,0,0,2024-08-05 13:22:38,23,185,1068,4.65,"im in research, but having talked to industry people: RLHF: has the highest ceiling of the options a...",Yes,4
post33tec,technical,deepest_subtree_kawin_e_level4,kawin_e,0,4,4,deepest_subtree_kawin_e_level4_comment_0002,CheetahFair2770,1,1,2024-08-05 13:36:54,3,19,119,5.21,thanks for your reply! do you think DPPKTO is less prone to overoptimization since they avoid reward...,Yes,4
post33tec,technical,deepest_subtree_kawin_e_level4,kawin_e,0,4,4,deepest_subtree_kawin_e_level4_comment_0003,kawin_e,2,2,2024-08-05 14:19:43,3,133,723,4.32,"it depends. if you do standard offline dpo, then its not really going to be prone to rewardhacking i...",Yes,4
post33tec,technical,deepest_subtree_kawin_e_level4,kawin_e,0,4,4,deepest_subtree_kawin_e_level4_comment_0004,Saltysalad,3,3,2024-08-05 15:06:08,1,13,83,5.38,Are pairs typically acquired by running the same input twice with high temperature?,Yes,4
post33tec,technical,deepest_subtree_kawin_e_level4,kawin_e,0,4,4,deepest_subtree_kawin_e_level4_comment_0005,kawin_e,4,4,2024-08-05 22:21:58,1,10,44,3.3,"That is a common way in which its done, yes.",Yes,4
post33tec,technical,deepest_subtree_kawin_e_level4,kawin_e,0,4,4,deepest_subtree_kawin_e_level4_comment_0006,South-Conference-395,3,3,2024-08-06 04:39:31,1,6,29,3.83,some results on this are out:,Yes,4
post33tec,technical,deepest_subtree_kawin_e_level4,kawin_e,0,4,4,deepest_subtree_kawin_e_level4_comment_0007,Internal_War3919,1,1,2024-08-06 04:09:25,1,83,523,5.14,Bestofn actually yield very strong results despite its simplicityOpenAI webgpt reported this. RAFT p...,Yes,4
post33tec,technical,deepest_subtree_kawin_e_level4,kawin_e,0,4,4,deepest_subtree_kawin_e_level4_comment_0008,maketheworldabetterp,2,2,2024-11-08 15:24:30,1,172,916,4.23,Bestofn can kinda be both an inference algo and training data enhancement method. Imagine originally...,Yes,4
post34con,controversial,deepest_subtree_Deleted_level4,Deleted,0,4,4,deepest_subtree_Deleted_level4_comment_0001,Deleted,0,0,2024-05-19 09:45:05,15,44,252,4.68,"I work in an AIrelated field, and I think people really underestimate how worldchanging its going to...",Yes,4
post34con,controversial,deepest_subtree_Deleted_level4,Deleted,0,4,4,deepest_subtree_Deleted_level4_comment_0002,TomDestry,1,1,2024-05-19 14:11:11,4,56,311,4.48,If you work in AI and think that there is generative AI smarter than Einstein then perhaps you can a...,Yes,4
post34con,controversial,deepest_subtree_Deleted_level4,Deleted,0,4,4,deepest_subtree_Deleted_level4_comment_0003,Deleted,2,2,2024-05-19 14:22:01,2,8,35,3.25,"Its not a question of if, but when.",Yes,4
post34con,controversial,deepest_subtree_Deleted_level4,Deleted,0,4,4,deepest_subtree_Deleted_level4_comment_0004,Deleted,3,3,2024-09-25 09:38:10,1,16,95,4.88,There is not a single AI to this date that developed thoughts themselves. Everything is reused.,Yes,4
post34con,controversial,deepest_subtree_Deleted_level4,Deleted,0,4,4,deepest_subtree_Deleted_level4_comment_0005,Jesus_LOLd,1,1,2024-05-19 09:51:21,4,40,218,4.33,You nailed it... BUT immigrants are generally not being brought in for white collar jobs. They are b...,Yes,4
post34con,controversial,deepest_subtree_Deleted_level4,Deleted,0,4,4,deepest_subtree_Deleted_level4_comment_0006,Deleted,2,2,2024-05-19 10:00:02,7,36,206,4.69,"Agree, but the logical followon to the bottom falling out of the white collar job market is that it ...",Yes,4
post34con,controversial,deepest_subtree_Deleted_level4,Deleted,0,4,4,deepest_subtree_Deleted_level4_comment_0007,Jesus_LOLd,3,3,2024-05-19 10:07:22,5,23,130,4.3,"15 to 30 years... lol no. Sincerely, the wrecking ball is swinging now and massive changes are mayyy...",Yes,4
post34con,controversial,deepest_subtree_Deleted_level4,Deleted,0,4,4,deepest_subtree_Deleted_level4_comment_0008,Wheloc,2,2,2024-05-19 10:05:54,6,12,74,5.08,"There are plenty of whitecollar immigrants too, often from Asia or Europe.",Yes,4
post34con,controversial,deepest_subtree_Deleted_level4,Deleted,0,4,4,deepest_subtree_Deleted_level4_comment_0009,beltway_lefty,3,3,2024-05-19 11:49:46,1,16,85,4.25,Yes but they are here on work visas. They are not crossing the border seeking asylum.,Yes,4
